wine_alcohol,wine_category,wine_country,wine_description,wine_name,wine_point,wine_price,wine_region,wine_variety
N/A,Red,US,"Dark and deep purple/black, with a Port-like nose. There's a little fizz on the palate, which seems odd in a wine this big, and the flavors are locked in tight. Flat, dry, tannic finish. ",Sonora 1998 TC Vineyard Old Vine Zinfandel (Amador County),84,21,California,Zinfandel
N/A,Port/Sherry,US,"A blend of Cabernet Franc and Cabernet Sauvignon, fortified with brandy and aged in oak has yielded a young gawky wine that tastes like you would expect: sweet cassis and plum fruit is married to plenty of vanilla and menthol oak. Hints of chocolate emerge on the finish. Light tannins and low acidity make this a Port that's made to drink soon, not for the extended aging of traditional vintage Ports. ",Pindar Vineyards 1997 Port (Long Island),86,25,New York,Port
15.6%,Red,US,"A chewy wine with tremendous extraction and flavor intensity, this has some Port-like qualities, and the flavors are tart-sweet, pruney, with nutty, almost bitter almond notes peeking through. Still young, it will be better in two years. Coses with a big, tooth-staining finish. ",Rancho Zabaco 1999 Chiotti Vineyard Zinfandel (Dry Creek Valley),88,22,California,Zinfandel
13.5%,Red,Australia,"Opens deep and inky with prune, licorice, chocolate, Asian spices and a touch of leather. If you think that's a lot of nose for a $13 Shiraz, you're right. The almost full-bodied palate delivers nicely on the bouquet's promise, with a creamy feel and bright, Port-like flavors—nuts, chocolate and prunes. Finishes with good length and more of the same delicious stuff. Grab a case for summer fun. ",Hope Estate 1999 Shiraz (Hunter Valley),89,13,New South Wales,Shiraz
15.5%,Red,US,"Monster aromas leap out of the glass, rich in plum and blackberry fruit, chocolate, spice and caramel. Tastes almost Port-like, with huge fruit flavors, a syrupy texture, slight sweetness, and a bit of heat from 15.5% alcohol. ",Terra d'Oro 1998 Deaver Vineyard Old Vine Zinfandel (Amador County),86,22,California,Zinfandel
13.5%,Red,Australia,"This wine's sweet edge will please those who haven't yet grown to appreciate complex Cabs. Aromas of mushrooms and wet soil burn off to reveal a sugary, grapey bouquet. Oak and an herbal, tarragon-like flavor dominate the palate; finishes with smoke and a sweet, Port-flavored candy taste. ",Wood Park 1998 Cabernet Sauvignon-Shiraz (King Valley),84,22,Victoria,Cabernet Sauvignon-Shiraz
13.5%,Red,Australia,"This tawny-black Riverland offering has a Port-like bouquet of stewed fruit, mulling spices and smoked meat. Superripe (perhaps overripe) blackberry fruit stars in the mouth, with ancho chile and black pepper flavors in supporting roles. This chewy Petit Verdot is, as the song goes, a bit too “Hot Hot Hot,” but is still an enjoyable drink. ",Bookpurnong Hill 1999 Petit Verdot (South Eastern Australia),85,40,Australia Other,Petit Verdot
13%,Red,Australia,"Lighter and more red-fruited than most Australian Cabs, Port-like qualities show in this wine's tawny hues and cherry, burnt sugar and earth bouquet. A mouth of slightly overripe berry fruit and the creamy, smooth texture are appealing, as is the attractively sweet, slightly hot finish. It's unusual, but that's not a bad thing. ",Angove's 1999 Classic Reserve Cabernet Sauvignon (South Eastern Australia),86,10,Australia Other,Cabernet Sauvignon
14%,Red,Australia,"This 100% Cabernet Sauvignon wine shows why Cab is the grape that made Coonawarra famous. Dense and Port-like in color, the full nose displays cassis, fruit, leather, tobacco, green olive and eucalyptus. Rich and supple on the palate, it still has plenty of backbone. The extracted black cherry flavors, accented by green olive, sun-dried tomato and mint, sit atop some firm tannins. It finishes long, but a little hard, and could use a few years in the cellar. ",Punters Corner 1998 Cabernet Sauvignon (Coonawarra),89,27,South Australia,Cabernet Sauvignon
13%,Red,Australia,"The dark cherry currant and cocoa fruit has an overripe, candied quality. It's wrapped in deep caramel-toasted oak, and has a plump, rather sappy feel. Almost Port-like, it's sweet and herbal at once—it's a bit out there, but will have appeal for the adventurous. ",Angove's 1999 Classic Reserve Shiraz (South Australia),83,9,South Australia,Shiraz
12.5%,Red,Argentina,"The berry–rhubarb fruit here shows a dry, sour note and also a slight mustiness. The mouthfeel is even and the wine has balance—it's not too short or too sharp—There's just not enough material here. Pepper and meat notes show on the short finish. ",Escalera al Sol 1999 Syrah (Mendoza),83,6,Mendoza Province,Syrah
13.5%,Red,US,"Very ripe—some tasters felt overtly overripe—aromas and flavors gave this wine a Port-like character. Prunes, figs and nuts, a supple, low-acid mouthfeel, and a long sweet-and-sour finish comprise an interesting, but not universally enjoyed package. A split decision, and very much a personal call. ",Monterra 1998 Syrah (Monterey),84,13,California,Syrah
13.8%,Red,US,"Briary berry, herb and vanilla aromas and flavors define this medium-weight, balanced wine. There are almost Port-like notes and white pepper accents on the palate, with a soft mouthfeel. On the back end, the wine turns leaner and more angular, showing some structure and a more serious metallic-herb note. ",Hogue 1999 Vineyard Selection Syrah (Columbia Valley (WA)),86,18,Washington,Syrah
N/A,Red,France,"What a nose. La Belle Marguerite's the color of ruby Port, so we shouldn't have been surprised at the luscious black currant, plum, black pepper and membrillo-paste aromas it showed. Cracked black pepper and curry notes spice up the palate's cherry, fresh red pepper and mineral flavors. Racy and medium-bodied, it finishes with more spice, plus some dried cherry notes. ",Labouré-Roi 1998 Domaine Sirugue Clos La Belle Marguerite  (Côte de Nuits-Villages),89,19,Burgundy,Red Blends
N/A,Red,US,"Dark and strong stuff here. Smells earthy and plummy, with a cut of green stalkiness and mint; turns heavy and dense in the mouth. Finishes Port-like, with heat and sweetness. ",Renaissance 1999 Zinfandel (North Yuba),81,19,California,Zinfandel
N/A,Port/Sherry,Portugal,"A lush, silky mouthfeel; bright berries come through the otherwise dark coffee- and chocolate-scented fruit to add interest. Nice balance, with soft tannins that make it approachable now but should allow it to age for 10 years or more. ",Cockburn's 1995 Quinta dos Canais  (Port),90,55,Port,Port
19.5%,Port/Sherry,Portugal,"Dark and masculine, there's a lot of coffee mixed with a deep undercurrent of orange. Big-bodied, full in the mouth and malty. A snappy tawny offering all that a good 10-year-old should. Fresh as can be and extremely well made. ",Ramos-Pinto NV Quinta da Ervamoira  (Port),90,34,Port,Port
17.4%,Red,Australia,"A delicious fruit-forward Port-style wine. It has a rich, silky texture, with concentrated, lingering fruit leading to a long and hugely satisfying finish. ",Benjamin NV Museum Reserve Tokay (Victoria),92,16,Victoria,Tokay
N/A,Red,US,"A hot-country Zin that's a bit over the top in terms of sugar and extract. Drinks almost Port-like, with raisiny flavors, and it finishes hot and bitter. ",Bridlewood 1998 French Camp Zinfandel (Paso Robles),83,16,California,Zinfandel
N/A,Red,US,"From 1,400-foot vineyards that are 90 years old. A huge, extracted Zin full of massive fruit. At 16.4% alcohol and 0.9% residual sugar, it's almost Port-like, with raisin and plum liqueur notes. ",Savannah-Chanelle 1997 Estate Zinfandel (Santa Cruz Mountains),84,36,California,Zinfandel
N/A,Red,US,"Superripe and bold, with major-league fruit flavors. Tiers of powerful wild berries, stone fruits, and oriental spices play on the palate. Drinks strong and slightly hot (14.3% alcohol). Full-bodied and almost Port-like. ",Lonetree 1996 Zinfandel (Mendocino),88,16,California,Zinfandel
16.8%,Red,US,"This is a bone-dry late-harvest Zinfandel made at the limits of dry red wine, with nearly 17% alcohol. It's aptly named; the aromas and flavors are robust and intense, almost Port-like except for the absence of sugar. Very nice drinking; pure and pleasurable, although at this size you have to be careful how much you drink. ",Kunde 1997 Robusto Zinfandel (Sonoma Valley),89,30,California,Zinfandel
N/A,Red,US,"Released after more than four years in barrel, this Bordeaux blend is just beginning to shed its aggressive tannins. Although there's plenty of toasty, charred oak, the fruit seems to have been sacrificed. Smells like a Port: peppery, pruny and alcoholic. ",Preston 1995 Platinum Red Red (Columbia Valley (WA)),81,17,Washington,Bordeaux-style Red Blend
15.5%,Red,US,"Ponderous aromas of Port, kirsch and cassis waft up from this 15.5% alcohol monster. This isn't Dolcetto in the Piemontese style. Here it's overripe cherries and plums emulating young Port. It goes best with food; on its own it's awkward and overamped. ",Fattoria Enotria 1997 Dolcetto (Mendocino),84,16,California,Dolcetto
13.5%,Red,Australia,"Impressive for sheer mass and the enormity of its fruits and spices, which makes it taste almost like fruitcake or a dry Port. Lavishly oaked, but the fruit and underlying structure of acids and tannins can handle it, resulting in a harmony and grace rare in a wine of this size. The finish goes on and on. ",Mitchelton 1996 Print Shiraz (Victoria),92,45,Victoria,Shiraz
13.9%,Red,US,"Packed in upfront, with some atypical grassy, wildflower aromas. Chunky fruit and Port-like flavors make a statement, as does a black-tea note on the finish. Slightly clumsy now, the hope here is that some time in the cellar will help weld any incongruent elements. ",Liparita 1997 Vineyard Reserve Cabernet Sauvignon (Napa Valley),88,65,California,Cabernet Sauvignon
13.4%,Red,US,"Some sweetness in the form of kirsch and Port, as well as chocolate and the clear essence of wood shavings. At only 53% Cabernet, there's lots of Merlot-influenced red fruit. It's more light and elegant than many dense Napa Cabs and keeps a reserved nature all the way through to the end. ",Rosenblum 1997 Holbrook Mitchell Trio Cabernet Sauvignon (Napa Valley),90,30,California,Cabernet Sauvignon
15.2%,Red,US,"Blackberry aromas have a Port-like character and a smoky undertone. Big extraction leaves a thick, weighty mouthfeel and the essence of Cabernet's sweetness. Some mineral, coffee and meat on the lengthy finish. A good mix of finesse and wildness. ",St. Supéry 1997 Dollarhide Ranch Limited Editi Cabernet Sauvignon (Napa Valley),92,70,California,Cabernet Sauvignon
13.8%,Red,US,"Full-priced, full-bodied, and the full complement of just about all you want in a Rutherford Cab. Port-like aromas lead a pure and layered palate that features cassis, cherry, tobacco and cocoa. What an array of flavors, and then it finishes with dusty tannins and a tight grip. The gang at BV sure know how to craft Cabernet. ",Beaulieu Vineyard 1997 Clone 4 Cabernet Sauvignon (Napa Valley),93,130,California,Cabernet Sauvignon
13%,Red,US,"Beets, mint and cola mark the aromas of this robust offering from the southern part of the state. It's rich and corpulent—almost Port-like in its dimensions—and although it lacks a bit of elegance, it certainly possesses plenty of mouth-filling flavor. ",Bridgeview 1998 Reserve Pinot Noir (Rogue Valley),87,20,Oregon,Pinot Noir
18.4%,Port/Sherry,US,"A blend of five traditional Port varieties, this is a sweet (10% residual sugar), very rich wine of substance and harmony. It has massive flavors of berries with sweet overlays of caramel, chocolate and mint, and the sugars are nicely balanced by crisp acidity, although the texture is soft and velvety. This tasty wine achieves the complexity and provides the satisfaction of a good late bottled vintage Port. Drink it now with rich chocolate-based desserts. ",Woodbridge 1994 Portacinco Port (California),90,20,California,Port
N/A,Red,US,"A bizarre style of wine. The aromas are Port-like—old Port—with a caramelized, candy-sugar note verging on pie crust. There's also a streak of clove. In the mouth, it's earthy and dense, with tomato flavors and a dash of sweetness from oak. ",Lafond 1997 Lafond Vineyard Pinot Noir (Santa Ynez Valley),82,35,California,Pinot Noir
13%,Red,Chile,"Sweet caramel, a touch of mintiness, and some earth-tinged cassis grace the nose. That's followed up by simple fruit flavors and a corpulent mouthfeel held together by some light tannins on the finish. ",Portal Del Alto 1999 Cabernet Sauvignon (Maule Valley),84,7,Maule Valley,Cabernet Sauvignon
12.5%,Red,Chile,"This is a well-made wine, correct in all respects but decidely light for a Cabernet Sauvignon, perhaps a reflection of the difficult 1998 (La Niña) vintage. However, its attractive flavor package and appraochable structure make for easy drinking with tonight's pasta or pizza. ",Portal Del Alto 1998 Reserva Cabernet Sauvignon (Maipo Valley),85,12,Maipo Valley,Cabernet Sauvignon
N/A,Red,Argentina,"Ripe and raisiny, with Port-like aromas and a chewy, rich body. If you appreciate berry fruit with a full texture and chocolaty nuances, then this will do the trick. Mostly simple in the end, but tasty along the way. ",Valentín Bianchi 2002 Malbec,88,18,Mendoza Province,Malbec
N/A,Red,Portugal,"The second label of Quinta de Roriz, from the lighter 2002 vintage, is a wine for early drinking. It has fresh red fruits, soft tannins and good balancing acidity. The word “prazo,” meaning “lease”, was the name given to the quinta in the 18th century. ",Quinta de Roriz 2002 Prazo de Roriz Red (Douro),85,13,Douro,Portuguese Red
N/A,Port/Sherry,US,"Sweet, rich in tannins, high in peppery alcohol and with a chocolatey, blackberry richness, this dessert wine is fun on its own, or beside a perfect espresso after a big, late night dinner. ",DeRose 1995 Port (Cienega Valley),85,26,California,Port
15%,Port/Sherry,Spain,"From Real Tesoro, this fino is dry and chalky, with spiky blanched-almond flavors and a heavy, astringent aftertaste of sautéed mushrooms. ",Marques del Real Tesoro NV Tio Mateo Fino Seco y Suave Sherry (Jerez),82,15,Andalucia,Sherry
N/A,Port/Sherry,US,"Mute aroma, but turns sweet and chocolatey-cherry in the mouth, with good acidity, and very clean. A pleasant dessert quaffer. ",Boitano 2002 Port (Sierra Foothills),86,14,California,Port
N/A,Port/Sherry,Portugal,"Not an intense or concentrated wine, perhaps, but this Reserve Port from Churchill's is well balanced and finely structured. There are flavors of green figs that give it freshness, and a dry aftertaste. A slight stalky flavor is the only off note. ",Churchill's NV Finest Vintage Character  (Port),86,17,Port,Port
N/A,Port/Sherry,Portugal,"W & J Graham makes one of the best-known Reserve Port brands. And a great wine it is, too. It is soft, but there are tannins. It is fruity, but there is good concentration. And with its flavors of ripe black figs and dark chocolate, it is an immediately appealing wine. ",W. & J. Graham's NV Six Grapes Reserve  (Port),89,21,Port,Port
N/A,Port/Sherry,Spain,"A classic manzanilla with aromas of honey, apple, blanched almonds and salt air. Fresh and exuding clarity not found in every fino or manzanilla. Quite apple-driven on the palate, with hints of mushroom and buttered toast. Flavorful, lithe and on the money. ",Barbadillo NV Solear Manzanilla Sherry (Jerez),89,9,Andalucia,Sherry
19%,Port/Sherry,Spain,"Almost shocking at first, due to strong, unyielding peanut and iodine aromas. Remains intense on the palate, where salt, butter and almonds mix nicely. Sharp and racy on the finish, with good flow. A word of warning: there's nothing cuddly or sweet about this. It's old-style, traditional Sherry made for the connoisseur. Imported by W.J. Deutsch & Sons. ",Osborne NV Solera Primera Rare Amontillado Sherry (Jerez),90,90,Andalucia,Sherry
18%,Port/Sherry,Spain,"It's rare that a sweet sherry reaches such heights, but here's a case in point. Iberia has impeccable prune and raisin aromas along with intoxicating scents of toffee and cane sugar. All in all, the bouquet is excellent. The palate, meanwhile, is seamless as it deals raisin, vanilla and mocha. Spot on for a dessert elixir, with a ceaseless finish. ",Sanchez Romate NV Iberia Cream Sherry (Jerez),93,15,Andalucia,Sherry
N/A,Port/Sherry,Portugal,"A pure fruited wine, with an unusual touch of toast and new wood. The fruit is well structured with flavors of thyme and rosemary. This is a smooth, polished Port, which is definitely in a modern style of winemaking. Imported by William Grant USA. ",Quinta do Noval 2003 Vintage  (Port),90,95,Port,Port
N/A,Port/Sherry,Portugal,"The wine is big, full, opulent and super-ripe. But the tannins are also there, giving a dark, brooding edge, which comes through powerfully on the finish. This is the best vintage yet from this Roederer-owned house. Imported by Maisons Marques & Domaines USA. ",Ramos-Pinto 2003 Vintage  (Port),94,65,Port,Port
N/A,Red,US,"Fully dry, at the cost of 15.8% alcohol, this enormous Zin wears its size well. There's a Port-like, raisiny note, but it's more of a subtle seasoning than a takeover, and the wine is balanced in its own distinctively Zinny way. ",Wellington 2003 100 Year Old Vines Zinfandel (Sonoma Valley),89,30,California,Zinfandel
20%,Port/Sherry,Portugal,"A very ripe style, with baked plum and prune aromas and flavors supported by hints of pastry crust and dried spices. Medium to full in body, with soft tannins and a long, spicy finish. Imported by Supreme Wines & Spirits. ",Quinta de Ventozelo 2000 LBV  (Port),89,19,Port,Port
N/A,Port/Sherry,Portugal,"Rather brown in color, this wine is sweet, soft and chocolaty, spoiled by volatility and unbalanced acidity. ",Messias NV 10-year old tawny  (Port),82,20,Port,Port
N/A,Port/Sherry,Portugal,"With French winemaker Jean-Hugues Gros (who used to work in Burgundy with Jacques Prieur) in charge, Heredias  is producing both table wines and Ports. This 10-Year Oldis sweet, fresh, with caramel flavors, leavened with fresh acidity in the aftertaste. ",Quinta das Heredias NV 10-year old tawny  (Port),86,28,Port,Port
N/A,Port/Sherry,Portugal,"A very sweet style, with flavors of Hershey bars, figs, vanilla and caramel. Rather out of balance. ",Offley NV 10-year old tawny  (Port),86,26,Port,Port
N/A,Port/Sherry,Portugal,"A dense, firm style of wine from this small Dutch-owned Port house. Offers good acidity, old wood and very bitter chocolate flavors. The aftertaste, by contrast, is sweet. ",C. da Silva NV Presidential 30-year old tawny  (Port),87,80,Port,Port
20%,Port/Sherry,Portugal,"If it wasn't for the unbalanced spirity element to this wine, it would rate higher. The concentration and the dried fruit and lemon jelly flavors are attractive. But that spirit comes through at the finish. ",Rozes NV 20-year old tawny  (Port),87,50,Port,Port
N/A,Port/Sherry,Portugal,"A delicious, easy wine that floats by with orange marmalade and fresh acidity. Marred on the finish by some volatility. ",Royal Oporto NV 20-year old tawny  (Port),87,48,Port,Port
N/A,Port/Sherry,Portugal,"This is a very easy, light and fresh style, with sweet caramel flavors balanced by sweet figs and milk chocolate. It finishes  clean, with just a touch of acidity. ",Quinta de Ventozelo NV 10-year old tawny  (Port),87,30,Port,Port
N/A,Port/Sherry,Portugal,"Ripe and fresh. There are touches of bitter oranges, lemon peel and ginger. The aftertaste is soft and sweet. ",Churchill's NV 10-year old tawny  (Port),87,30,Port,Port
N/A,Port/Sherry,Portugal,"A fine, sweet, fresh wine, which tastes younger than 30 years. The flavors are ripe, layering milk chocolate with acidity in good balance. ",Kopke NV 30-year old tawny  (Port),87,122,Port,Port
N/A,Port/Sherry,Portugal,"A generally balanced sweet wine, with layers of candied fruits, and sweet marmalade flavors. The ripeness and the sweetness are spoiled by the volatility that shows in the finishing acidity. ",Poças NV 20-year old tawny  (Port),87,50,Port,Port
N/A,Port/Sherry,Portugal,"A very soft style from a vineyard run by the Olazabal family. There is sweetness, allied with cocoa flavors and a touch of burnt coffee. There's a very attractive sweet black fig character to finish. ",Quinta do Vallado NV 10-year old tawny  (Port),87,10,Port,Port
N/A,Port/Sherry,Portugal,"Santa Eufemia is a new name on the U.S. market, from a vineyard in the Baixo Corgo, the western end of the Port vineyards. This is a mature 10-year-old, light in color and dry, with coffee and cocoa flavors. There is a delicious, lightly acidic, long-lasting aftertaste. ",Casa Santa Eufemia NV 10-year old tawny  (Port),88,39,Port,Port
N/A,Port/Sherry,Portugal,"A very sweet rich wine, in the Fonseca house style. But it lacks the intensity, going more for sweet almonds, along with some bitter marmalade, and a young taste. Imported by Kobrand. ",Fonseca NV 40-year old tawny  (Port),88,157,Port,Port
N/A,Port/Sherry,Portugal,"Very soft, but with good concentration, this bitter orange flavored wine has ripeness, but also acidity, finishing with some bitter chocolate flavors. Attractively balanced. ",Delaforce NV His Eminence's Choice 10-year old tawny  (Port),88,23,Port,Port
N/A,Port/Sherry,Portugal,"Barros is not well known outside Portugal, but this wine suggests it should be. Delicate and perfumed, this has a fine balance that leaves a fresh, fruity aftertaste. There is structure, sweetness and ripeness. ",Barros NV 10-year old tawny  (Port),88,22,Port,Port
N/A,Port/Sherry,Portugal,"A clean, very poised style, with attractive acidity and good balance. It's just as deliciously fresh as a 10-Year Oldshould be. ",Wiese & Krohn NV 10-year old tawny  (Port),88,25,Port,Port
N/A,Port/Sherry,Portugal,"An intensely sweet wine, with mature fruit that shows some richness and orange marmalade flavors. It is spoiled by a hint of volatility, which leaves a sharp aftertaste. Imported by Admiral Imports. ",Royal Oporto NV 40-year old tawny  (Port),88,128,Port,Port
N/A,Port/Sherry,Portugal,"Layers of dried fruits and prunes give a fruity character to this gently sweet wine. It's very elegant and delicate, but certainly very drinkable. ",Quinta de Ventozelo NV 20-year old tawny  (Port),88,40,Port,Port
N/A,Port/Sherry,Portugal,"A full-bodied, dense and very concentrated wine that just misses being intensely rich because of a touch of burnt rubber. It is certainly powerful, and the dried prune flavors are ripe and sweet. ",Quinta do Vallado NV 20-year old tawny  (Port),88,20,Port,Port
N/A,Port/Sherry,Portugal,"Apart from the fact that this tastes too fresh to be a 30-year-old, this is a delicious wine, with ripe, sweet fruits, caramel and just the right layer of dryness. ",Taylor Fladgate NV 30-year old tawny  (Port),88,115,Port,Port
N/A,Port/Sherry,Portugal,"A firm style of wine, from the oldest Port producer. With tannins and bitter almond and chocolate flavors, this is certainly on the drier side. ",Kopke NV 10-year old tawny  (Port),88,28,Port,Port
N/A,Port/Sherry,Portugal,"Caramel, white chocolate aromas, and unbalanced sweet and sour flavors just do not show well together in this disappointing wine. ",Warre's NV Sir William 10-year old tawny  (Port),83,26,Port,Port
N/A,Port/Sherry,Portugal,A very old wine which smells medicinal and tastes like sweet cough syrup. It's so concentrated as to be almost undrinkable. ,Rozes NV 40-year old tawny  (Port),83,120,Port,Port
N/A,Port/Sherry,Portugal,"A very old, too concentrated, medicinal, Italian bitters-flavored wine that tastes too herbal to give much pleasure. Imported by Wine Worth LLC. ",Kopke NV 40-year old tawny  (Port),83,180,Port,Port
N/A,Port/Sherry,Portugal,This wine certainly doesn't taste its age. It has more to do with sweet almond cookies and unbalanced spirit than mature flavors. Imported by Langdon Shiverick. ,Quinta das Heredias NV 40-year old tawny  (Port),83,130,Port,Port
N/A,Port/Sherry,Portugal,"A hugely, almost uncomfortably sweet wine with strong aromatics. It has some attractive acidity, but the sweetness detracts from any other character. ",Cockburn's NV 10-year old tawny  (Port),83,30,Port,Port
N/A,Port/Sherry,Portugal,"An easy, fresh, ripe style, with dried fruits and a perfume note that is spoiled  by the rubber character and some old wood. Anybody who stays in Portugal's pousadas, the state-run hotels, will have had this brand. ",C. da Silva NV Presidential 20-year old tawny  (Port),84,50,Port,Port
N/A,Port/Sherry,Portugal,"Oreo eaters will enjoy the aromas of this wine, with its sweet, milk chocolate tastes. But apart from that it is unbalanced, too acid for real pleasure. ",Casa Santa Eufemia NV 30-year old tawny  (Port),84,30,Port,Port
N/A,Port/Sherry,Portugal,"This is a very old 40-year old, with some harsh, burnt and rubber flavors. There's high acidity and caramel toffee, masking the mature fruit. Imported by HGC Imports. ",Poças NV 40-year old tawny  (Port),84,130,Port,Port
N/A,Port/Sherry,Portugal,"This is more like an Italian bitters than a Port, with its roasted coffee aromas, and bitter flavors. Almost medicinal. ",Messias NV 30-year old tawny  (Port),84,60,Port,Port
N/A,Port/Sherry,Portugal,"A sadly unbalanced wine from a company that has a name for tawny Ports. With its sweetness, marred by a touch of reduction (too long in old barrels?), it has a curious sweet/sour aftertaste. ",Ferreira NV 10-year old tawny  (Port),84,10,Port,Port
N/A,Port/Sherry,Portugal,"This is very burnt, offering concentrated old fruit flavors and tasting very mature, straight from the barrel. There's some bitterness, but the main impression is of very old wine. Imported by T. Edward Wines Ltd. ",Casa Santa Eufemia NV 40-year old tawny  (Port),85,40,Port,Port
