wine_alcohol,wine_category,wine_country,wine_description,wine_name,wine_point,wine_price,wine_region,wine_variety
13.6%,Red,US,"This variety is one of the traditional Port grapes. It should do well as a dry wine in the hotter areas of California, but no one has figured out how to make it happen. This bottling by Kenneth Voik does not advance the cause. The wine is heavy and dull. ",Kenneth Volk 2010 Pomar Junction Vineyard Touriga Nacional (Paso Robles),82,36,California,Touriga Nacional
16.1%,Red,US,"The texture is smooth and velvety on this Zinfandel, but the flavors are off. You'll find ripe blackberry jam and currants right next to overripe raisins. Enormously high alcohol makes this wine taste like a fruity, simple port. ",Hidden Oak 2010 Zinfandel (Monterey County),84,30,California,Zinfandel
15.4%,Red,US,"High alcohol sticks out on this wine, giving it a dry heat, while raisin flavors suggest a port-like overripeness. It's not going anywhere, so drink up. ",Kaleidos 2008 Halter Ranch Syrah (Paso Robles),84,40,California,Syrah
N/A,Port/Sherry,Portugal,"This opulent wine is very ripe. From Dow's flagship vineyard, it is a sweeter wine than many of its kind, showing a caramel note and soft tannins. Within all of its sweet fruit is a firm, dry, structured core. ",Dow's 2009 Quinta do Bomfim Vintage  (Port),93,48,Port,Port
N/A,Port/Sherry,Portugal,"A firm and very structured wine, this is for long-term aging. At this young stage, the fruit seems extracted, but this will pass as the weight of the dense damson skin and tannic character shines through. Complex and finally ripe. ",Duorum 2009 Vintage  (Port),93,80,Port,Port
N/A,Port/Sherry,Portugal,"This rich and juicy wine from the Pinhão Valley has enormous potential, as shown by its strong, tannic character and firm structure. The foot-trodden grapes lend great flavor intensity, fine concentration and a note of blackberry juice. It will age well. ",Wine & Soul 2009 Pintas Vintage  (Port),94,80,Port,Port
N/A,Port/Sherry,Portugal,"This ripe and full-bodied wine from Cristiano van Zeller is powerfully concentrated, showing all the right weight while also providing generous fruitiness. Rich black fruits and sweet tannins are layered with acidity. This is a wine for long-term aging. ",Quinta Vale Dona Maria 2009 Vintage  (Port),95,57,Port,Port
N/A,Port/Sherry,Portugal,"The concentration of old vines is very evident in this wine, which uses fruit that was sourced from a portion of old vines in Niepoort's Quinta da Pisca. There is a touch of bitter cherry, as well as a firm, dense core that shows a fine balance of acidity. This is powerful, full-bodied and packed with dark fruit—for long-term aging. ",Niepoort 2009 Bioma Vinha Velha Vintage  (Port),96,100,Port,Port
14.8%,Red,US,"This is heavy, soft and overripe, with raisin and Port-like flavors. ",Bianchi 2009 Petite Sirah (Paso Robles),81,22,California,Petite Sirah
18%,Fortified,US,"As the name suggests, this blend of Merlot and Cabernet Sauvignon does taste big and bold, but it also tastes hot and lopsided. It has a Port-like consistency, with notes of charred sesame seed, chocolate and dark cherry that lack precision. ",Tarara 2010 Whitie's D9 A Big Bold Red (Virginia),83,50,Virginia,Red Blends
20.5%,Dessert,US,"Made from traditional Port varieties, this wine is very sweet, and unfortunately there's not a lot going on beyond that. The blackberry and chocolate flavors need a lot more concentration to stand up to the residual sugar. ",Robert Hall 2008 Vintage Port (Paso Robles),85,36,California,Port
15%,Red,US,"High alcohol gives this wine prickly, peppery heat. Although it's dry, it's Port-like, with raisin, blackberry, white pepper, licorice and bacon flavors. Give it credit for sheer power. It will age, without ever losing its rustic character. ",Wine Guerrilla 2010 Monte Rosso Vineyard Block E44 Zinfandel (Sonoma Valley),87,42,California,Zinfandel
16%,Red,US,"Gigantic is just one word to characterize this Zinfandel. For starters, it's enormously high in alcohol—at 16% by volume, it's almost Port-like. Yet it's dry and smooth in tannins, and the heat gives a heady boost to the black currant, black pepper and sweet oak flavors. Not for everyone, but it defines this powerful Dry Creek style of Zin. ",Michael David 2010 Rage Zinfandel (Dry Creek Valley),88,59,California,Zinfandel
13%,Red,France,"Soft and already approachable, this is a red-fruited wine, with ripe, well-integrated tannins and juicy acidity. It's round, fruity and ready to drink. ",Château du Port 2010 Tertre-Perdigous Malbec (Cahors),88,16,Southwest France,Malbec
12.5%,Red,France,"Using fruit sourced from old vines, this firm, tannic and concentrated wine has a fine balance between the dense texture and bright black-plum and berry flavors. Given its tannic structure, it needs to age, although it would be a great accompaniment to a stew if consumed now. ",Château du Port 2010 Cuvée Prestige Malbec (Cahors),90,25,Southwest France,Malbec
14.7%,Red,US,"An inaugural release from veteran winemaker Nils Venge, this wine contains small amounts of Merlot and Petit Verdot. It's very dry, quite tannic and rich, with flavors of black cherries, currants and new oak, with an earthy note that adds to the complexity. The mouthfeel is warm and almost Port-like. ",Pellet Estate 2010 Pellet Vineyard Cabernet Sauvignon (Napa Valley),93,85,California,Cabernet Sauvignon
20%,Dessert,US,"Made using classic Port grape varieties, this is rich and sweet, with chocolate, coffee, orange, plum and spice flavors. Crisp acidity provides needed balance. It shows a complexity that lifts it above the ordinary. Drink now–2015. ",Williams Selyem 2006 Mistral Port (Central Coast),93,40,California,Port
16%,Red,US,"This tastes sweet and hot, which gives the flavors of blackberry and raisin a Port-like character. ",Tin Barn 2010 Gilsson Vineyard Zinfandel (Russian River Valley),81,27,California,Zinfandel
15.4%,Red,US,"This Zinfandel tastes and feels hot and Port-like. While some people enjoy this style, it feels a bit clumsy and overripe. Nonetheless, the blackberry, raisin and chocolate flavors are tasty. ",Mazzocco 2010 Briar Zinfandel (Dry Creek Valley),82,32,California,Zinfandel
16.4%,Red,US,"The high alcohol gives this wine glycerine-driven sweetness and Port-like heat. With its raisin and chocolate flavors, this is Mazzocco's signature style. ",Mazzocco 2010 Smith Orchard Reserve Zinfandel (Dry Creek Valley),83,52,California,Zinfandel
N/A,Port/Sherry,Portugal,"This is a firm and powerful wine, chunky and dense. It has a solid edge of tannins, dark and dense, resulting in a mineral-structured wine that is both dry and likely to age for many years. ",Burmester 2010 Quinta de Arnozelo Vintage  (Port),89,70,Port,Port
N/A,Port/Sherry,Portugal,"Dense in color, this firm wine has a rich black-fruit character. There is a strong element of acidity, which brings out the natural fruitiness of the wine. At the same time, there is enough dense texture to promise aging. ",Cálem 2010 Vintage  (Port),89,60,Port,Port
N/A,Port/Sherry,Portugal,"While there are medicinal aromas, suggesting some new wood in the aging process, the flavors are of rich, ripe fruits. For medium-term aging. ",Quinta Nova de Nossa Senhora do Carmo 2009 Vintage  (Port),90,70,Port,Port
N/A,Port/Sherry,Portugal,"This is a big, fruity wine, packed with sweet, ripe fruit. There is a fine mineral texture to balance this richness, which gives it a severe edge and promises aging. ",Kopke 2009 Quinta de São Luiz Vintage  (Port),90,75,Port,Port
N/A,Port/Sherry,Portugal,"This is a perfumed wine with fine acidity. The tannins are soft, accompanied by black cherry and ripe berry notes, making this a sweet, rich style. The Quinta Senhora de Ribeira is on the north bank of the Douro, facing Quinta do Vesúvio on the south bank. ",Dow's 2010 Quinta Senhora da Ribeira Vintage  (Port),90,60,Port,Port
N/A,Port/Sherry,Portugal,"With firm and structured tannins, the wine has strong potential. It also has an element of blackberry juice that provides ripe fruit as well as acidity. There is a cool feel to this wine, with a dry finish. ",Warre's 2010 Quinta da Cavadinha Vintage  (Port),91,88,Port,Port
N/A,Port/Sherry,Portugal,"Better known for its table wines, Quinta do Crasto still retains an important Port program. This big, dry and smoky effort fully justifies that. It is firmly structured and tannic, with a strong black-pepper character that is balanced by the solid structure and concentration.  Age over many years. ",Quinta do Crasto 2010 Vintage  (Port),91,78,Port,Port
N/A,Port/Sherry,Portugal,"This is intensely perfumed, with soft tannins that are followed by a dry, concentrated character. From the iconic Vesúvio Vineyard, where wines for vintage production are still foot trodden, this has a ripe feel, with tannins that are suitable for medium-term aging. ",Quinta do Vesuvio 2010 Vintage  (Port),91,65,Port,Port
N/A,Port/Sherry,Portugal,"On the north bank of the river, the remote Quinta dos Canais has produced a ripe, richly textured, perfumed wine that's packed with sweet berry flavor. It is concentrated, complete and softly tannic, suggesting medium-term aging. ",Cockburn's 2010 Quinta dos Canais Vintage  (Port),91,50,Port,Port
N/A,Port/Sherry,Portugal,"A smooth, rich, almost toffee-flavored wine, this has ripe black-plum and raisin notes, with hints of pepper and dark chocolate. From what has become Cockburn's flagship quinta, this is a delicious wine for  medium-term aging. ",Cockburn's 2009 Quinta dos Canais Vintage  (Port),92,50,Port,Port
N/A,Port/Sherry,Portugal,"This firm, perfumed, dry wine has concentrated spice and raisin flavors. Owned by the group that also owns Taylor Fladgate and Fonseca, Romariz continues to forge its own identity. ",Romariz 2009 Vintage  (Port),92,55,Port,Port
N/A,Port/Sherry,Portugal,"A firm and structured wine, this shows complex tannins as well as contrasting acidity. It feels complete, the tannins supporting red cherry and spice flavors. It is probably not for long-term aging but will start to taste delicious in 6–7 years. ",Dow's 2010 Quinta do Bomfim Vintage  (Port),92,48,Port,Port
N/A,Port/Sherry,Portugal,"Fine and ripe, this is a sweet—while also complex—wine from Graham's flagship estate. Its tannins lead easily to ripe flavors of black plum and berry juice, resulting in a wine that is firm, full bodied, fruity and generous. It needs to age. ",W. & J. Graham's 2010 Quinta dos Malvedos Vintage  (Port),93,58,Port,Port
N/A,Port/Sherry,Portugal,"With firm, smoky tannins and a dark bitter-cherry flavor, this is a dense wine. It is fully ripe and rich, with a firm kick at the back. Tough and age worthy, it expresses the schist soil of the region. ",Duorum 2010 Quinta do Castelo Melhor Vintage  (Port),93,75,Port,Port
N/A,Port/Sherry,Portugal,"This is opulent, with a perfumed character. It has ripe tannins, which add to the wine's generous nature. The dry edge that comes from the core provides a solid, structured side to this age-worthy effort. ",Quinta do Passadouro 2009 Vintage  (Port),93,80,Port,Port
14.8%,Red,US,"This is just barely drinkable, with modest blackberry fruit. It's hot and Port-like, right through the raisiny finish. ",Calcareous 2009 Cabernet Sauvignon (York Mountain),80,36,California,Cabernet Sauvignon
N/A,Red,France,"This warm wine is reminiscent of vintage Port. It is sweet, with dominating nut and superripe fruit flavors. It's soft and gently flabby. ",Château Beau Rivage 2009  Bordeaux Supérieur,83,25,Bordeaux,Bordeaux-style Red Blend
15%,Red,US,"An overripe, high-alcohol wine, this shows bold flavors of raisin, plum, prune, dark chocolate and spice. It almost tastes like Port, although it's dry. ",Zahtila 2008 Mayo Family Vineyards Old Vine Zinfandel (Dry Creek Valley),84,35,California,Zinfandel
N/A,Port/Sherry,Portugal,"Curiously perfumed and soft in character, this seems already drinkable. It has a geranium fragrance, followed by a strawberry flavor, creating the impression of a light wine. ",Kopke 2010 Quinta de São Luiz Vintage  (Port),86,70,Port,Port
N/A,Port/Sherry,Portugal,"Floral aromas offer an enticing entry to this soft wine that has the weight of a table wine. Its flavor of juicy blackberry precedes a fragrant, open finish. ",Quinta do Vallado 2009 Vallado Adelaide Vintage  (Port),87,100,Port,Port
N/A,Port/Sherry,Portugal,"This wine's red berry flavor and soft structure suggest that it will age quickly. However, for now it offers a ripe texture and a juicy character. ",Burmester 2009 Quinta de Arnozelo Vintage  (Port),87,75,Port,Port
N/A,Port/Sherry,Portugal,"An awkward geranium aroma mars this firm and concentrated wine. It's dry and tannic, with a solid edge akin to black currant skin. The fruit is well hidden at this stage. ",Quevedo 2010 Vintage  (Port),87,70,Port,Port
N/A,Port/Sherry,Portugal,"This is initially soft, then it broadens out with caramel and ripe plum flavors. Dark cherry sweetens the core of acidity and firm tannins. The wine has good potential. ",Barros 2009 Vintage  (Port),88,65,Port,Port
N/A,Port/Sherry,Portugal,"A ripe wine from the Real Companhia Velha, this shows a rich character, its tannins ripe and generous. It's not a huge wine, but it does show a fine, full-bodied flavor of sweet plum. The final feeling is smooth and opulent. ",Royal Oporto 2009 Vintage  (Port),88,60,Port,Port
14%,Red,Portugal,"This big, bold, structured offering is full of ripe blackberry flavor and integrated tannins. It is intensely rich and already delicious. Bomfim is the main winery for the Dow Port brand. ",Symington Family Estates 2009 Vale do Bomfim Red (Douro),88,12,Douro,Portuguese Red
20%,Port/Sherry,Portugal,"This 10-year-old tawny is on the fruity side of this style. It is an easy, dried-fruit-flavored wine with a texture like smooth toffee. Hints of apricot and milk chocolate grace the finish of this ripe Port. ",Barão de Vilar NV 10 Anos Collections Tawny  (Port),88,10,Port,Port
19.5%,Port/Sherry,Portugal,"This Port is structured, with notes of mint and herb. It has blackberry jam flavor and a firm, solid structure, while it also shows intense youthful fruitiness. It is rich and full, showing some firm tannins. Either drink it right now, or leave it for 10 years. ",Quevedo 2010 Quinta Vale d'Agodinho Vintage  (Port),88,75,Port,Port
20%,Port/Sherry,Portugal,"This is a finely balanced LBV with structure complementing the luscious black-fruit and raisin flavors. The wine is rich and densely textured, very smooth and unctuous. Big tannins suggest that the wine could age. ",Dão Sul 2008 Quinta das Tecedeiras LBV Late Bottled Vintage  (Port),89,20,Port,Port
13%,Red,Portugal,"Ripe and complex, this has big, spicy fruit that rises above the tannins to give a sweet, full mouthfeel. Below the fruit, the dry tannins and wood aging promise the aging potential of three years. ",Prats & Symington LDA 2010 Post Scriptum de Chryseia Red (Douro),90,24,Douro,Portuguese Red
13.5%,Red,Portugal,"Sourced from old vines, this elegant offering shows delicious fruit and great depth of flavor. The tannins slide easily into the red berry note and layered acidity. It shows the structure of the Douro while maintaing an accessible style. ",Symington Family Estates 2009 Vale do Bomfim Reserva Red (Douro),91,25,Douro,Portuguese Red
14%,Red,Portugal,"Smooth and rich, this is full of generous, opulent black-fruit flavors. This second wine from the legendary Vesuvio estate is a grand cru in its own right—powerful, structured and full of extremely ripe fruit. It is delicious, but will benefit from 3–4 years of aging. ",Quinta do Vesuvio 2009 Pombal de Vesuvio Red (Douro),92,28,Douro,Portuguese Red
14.5%,Red,Portugal,"Still an icon of Douro reds, this is marked by elegance. The fruit blends effortlessly with the acid-laced, firm tannins. It has fine potential for aging over at least five years. ",Prats & Symington LDA 2009 Chryseia Red (Douro),94,55,Douro,Portuguese Red
13.5%,Red,Portugal,"Capable of standing alongside the great Ports of Vesuvio, this table wine reveals the fantastic quality of its vineyard. It is both powerful and elegant, a wood-aged wine bearing a dense, dark flavor of black plum, with damson-tinged acidity. This impressive wine needs more than 5–6 years of aging. ",Quinta do Vesuvio 2009 Red (Douro),95,73,Douro,Portuguese Red
16.4%,Red,US,"Soft and sweet, this manages to combine Port-like and vegetal flavors in the same glass. The alcohol is an unmanageable 16.4% by volume. ",Hoyt Family Vineyards 2009 Dylema Red (Paso Robles),80,22,California,Red Blends
16.2%,Red,US,"This is a sound example of the warm-climate style of Zinfandel. It's high alcohol gives it a hot, chili-pepper-like sting, and the blackberry fruit has a Port-like, raisiny edge. ",Turley 2010 Dogtown Vineyard Zinfandel (Lodi),84,38,California,Zinfandel
15.2%,Red,US,"This smells dark and bold, offering Port-like aromas of chocolate ganache, buttercream frosting, brown spice and sun-baked fruit. Hearty and toasty, the palate packs plenty of muscle in the form of strapping tannins and supporting acids. Pair this with seared flank steak with a coffee-soy rub to accent the wine's decadence. ",Breaux 2007 Meritage Cabernet Sauvignon-Merlot-Malbec-Petit Verdot-Cabernet Franc Red (Virginia),87,32,Virginia,Bordeaux-style Red Blend
15%,Red,Spain,"This is heavy and raisiny, with ripe earth and mineral aromas that are suggestive of Port. It feels loaded and scratchy, with licorice, prune and pepper flavors that finish short and with some heat. A bullish style to drink now. ",Cyan 2010 8 Meses  (Toro),87,15,Northern Spain,Tinta de Toro
20%,Port/Sherry,US,"The nose drips with browned butter and herbal liqueur accents, with added complexities of spiced fruitcake, cocoa and roasted nut. Huge in flavor, the palate is chocolaty and nutty, with a salient oloroso-like quality. It finishes on a gutsy toasted-almond note. ",Mount Pleasant Winery NV Tawny  Library Vol. XIV Port (Augusta),87,55,Missouri,Port
18%,Port/Sherry,US,"A compelling Port-like wine made from Petite Sirah, ZInfandel and Syrah grapes aged more than 10 years to form this mix of almonds and sweet apple pie laced with caramel, smooth and easy to drink and pleasant in its Armagnac-like aromas. The almonds come back, laced in maple syrup, on the finish. ",Fenestra NV Tawny Port Port (Lodi),88,35,California,Port
15%,Red,US,"Ripe to the point of smelling like Port, this is a wine for those who relish sweet flavors of raisin, cooked fig, and ultraripe tree fruit in their Cabernets. This has so much fruit it almost seems to have some sweetness. Drink this soon, while some youthful freshness remains. ",Adams Bench 2009 the V Cabernet Sauvignon (Columbia Valley (WA)),89,49,Washington,Cabernet Sauvignon
14.8%,Red,US,"This shows the Rockpile personality with its intensely jammy raspberry, cherry and chocolate flavors that are accented by a bit of Port-like heat and set off by good acidity. The pleasure is in the power. ",Bruliam 2010 Rocky Ridge Vineyard Zinfandel (Rockpile),89,35,California,Zinfandel
18%,Port/Sherry,Spain,"Golden-brown in color, this has heady aromas of cola, nut, nutmeg, root beer and caramel. It feels full, slightly rich and properly cut, with coffee, toffee, chocolate and honey flavors. A balanced but elevated dessert-style Sherry that gets it right. ",Bodegas Dios Baco S.L. NV Cream Sherry Sherry (Jerez),90,15,Andalucia,Sherry
18%,Port/Sherry,Spain,"With a nose of toffee, dried apricot, cocoa powder and rancio, this is classic off-dry amontillado. It feels fresh and active, then tastes rich and moderately sweet, with flavors of hazelnut, caramel, toasted banana, orange and spice. Nutty and smooth on the finish. ",Bodegas Dios Baco S.L. NV Amontillado Sherry (Jerez),90,15,Andalucia,Sherry
17%,Port/Sherry,Spain,"A sensuous sweet Sherry, this has the full monty of fig, date, licorice, root beer and chocolate aromas and flavors. It's naturally thick and sweet but also balanced, so it doesn't come across like a spoonful of syrup. Great as a dessert wine with cake or blue cheese, but also as a topping for vanilla or coffee ice cream. ",Bodegas Dios Baco S.L. NV Oxford 1.970 Pedro Ximénez (Jerez),91,15,Andalucia,Pedro Ximénez
19%,Dessert,US,"Gorgeous and authentic, this full-flavored, Port-style wine renders deep, flavors of black cherry and cassis liqueur. Dark veins of chocolate syrup and coffee liqueur pump through the mix, making it smooth as butter. It's a wine that could age—but why wait? ",Thurston Wolfe 2009 Touriga Nacional Port (Yakima Valley),92,16,Washington,Port
19%,Dessert,US,"Opulento is made entirely- with authentic Portuguese varieties, based on 60% Touriga Nacional. It's truly Port-like in flavor, showing deep notes of black cherry and cassis fruit. Smooth and supple, this is thoroughly delicious and should not be missed. ",Brian Carter 2009 Opulento Dessert Wine Touriga-Souzao-Tinto Cão Port (Yakima Valley),94,20,Washington,Port
14.2%,Red,US,"In this wine, it appears that 2008's late-season heat spikes got the best of the grapes. The wine has raisiny, Port-like aromas and tastes, with bitterness from shriveled raisin skins. It doesn't offer much pleasure. ",Martin Ranch 2008 Thérèse Vineyards Cabernet Sauvignon (Santa Cruz Mountains),81,45,California,Cabernet Sauvignon
14.9%,Red,US,"This is so overripe that it tastes like Port, with raisin and milk chocolate flavors, and a hot, spicy finish. ",X 2008 Mash Red (Napa Valley),81,60,California,Red Blends
14.2%,Red,US,"This is a fruit-driven, sharp and Port-like red wine, blended from Petit Verdot, Malbec, Grenache and Nebbiolo. ",X 2009 Saved Red (California),81,35,California,Red Blends
14%,Red,US,"This tastes like Port, with raisin, prune and chocolate flavors. Drink up. ",Martin Ranch 2008 J.D. Hurley Cabernet Sauvignon (Santa Cruz Mountains),81,25,California,Cabernet Sauvignon
15.4%,Red,US,"Thick and heavy, this is Port-like in its toffee and raisin aromas, with a trace of licorice in the background. Its syrupy consistency almost expresses an air of oxidation. ",Domenico 2007 Primitivo (Amador County),83,30,California,Primitivo
13.5%,Red,Portugal,"This jammy, fruity offering tastes as though it were made from overripe fruit. Its light structure offers acidity and a Port-like character. Not for aging. ",Quinta de Ventozelo 2010 QV Tinto Red (Douro),84,13,Douro,Portuguese Red
14.5%,Red,US,"From a vineyard west of Ukiah, Jacuzzi Family's Barbera seems tartly sweet, akin to raspberry syrup laced with vanilla. Soft and round, it has a finish like that of an aged Port. ",Jacuzzi 2010 Barbera (Mendocino County),84,16,California,Barbera
12.5%,White,Portugal,"The historic Port house of Delaforce has now launched its own Douro table wines, and this Alvarinho is soft and fruity. It has a creamy initial texture followed by touches of vanilla and quince. This is not for aging, so drink it now. ",Delaforce 2011 Alvarinho (Duriense),85,17,Duriense,Alvarinho
15.2%,Red,US,"High alcohol and very ripe fruit combine to make this reminiscent of Port. It tastes of black currant and blackberry jam, with a hint of raisin. Although it won't please everyone, it is a good example of its warm-climate style. ",Dunning Vineyards 2010 Reserve Zinfandel (Paso Robles),85,38,California,Zinfandel
14.7%,Red,US,"It's easy to imagine drinking this wine—and really enjoying it—in Paso Robles with a grilled steak. It's rich, heady and ripe in black currants, with a Port-like, raisiny taste. ",La Filice 2009 Via Della Vigna Red (Paso Robles),87,25,California,Red Blends
15.4%,Red,US,"While this Cabernet is very rich and ripe in flavors of blackberry and cherry jam, crème de cassis and new oak, it's also very tannic. That bite of astringency gives it a rustic note. A very high, Port-like alcohol level may or may not thwart cellaring plans. ",Grgich Hills 2008 Yountville Selection Cabernet Sauvignon (Napa Valley),88,150,California,Cabernet Sauvignon
14.5%,Red,Chile,"At first it almost smells too Port-like, but then peppery spice enters the picture and it takes off. And while it weighs a ton and shows some aggression, it's lovable for its pure blackberry and complex spice and chocolate flavors. Long and grabby on the finish, with big tannins. Drink now, or hold through 2020. ",Estampa 2008 Lacruz Red (Colchagua Valley),92,55,Colchagua Valley,Red Blends
14.8%,Red,US,"This is too ripe, with a disagreeable pruny taste. The wine is dry and full bodied, but is almost like a minor Port. The official alcohol reading is 14.8% by volume, but it tastes higher and hotter than that. ",Heart O' The Mountain 2009 Estate Reserve Pinot Noir (Santa Cruz Mountains),82,48,California,Pinot Noir
16.2%,Red,US,"This seems so sweet, it's practically a Port dessert wine. It's soft and simple, with chocolate and blackberry jam flavors. ",Calcareous 2010 Zinfandel (Paso Robles),82,34,California,Zinfandel
15.4%,Red,US,"With very high alcohol, this is almost a dessert, Port-style wine. It's soft and hot, with sweet blackberry jam, milk chocolate and licorice flavors. ",Minassian-Young 2010 Estate Zinfandel (Paso Robles),84,25,California,Zinfandel
14.8%,Red,US,"This seems sweet like a Port. It tastes like raspberry and cherry jam, with lots of heat from the alcohol. ",Minassian-Young 2010 1000 Vines Zinfandel (Paso Robles),84,25,California,Zinfandel
13%,White,France,"This is a pleasantly quaffable Viognier, with restrained apricot and melon aromas and flavors. It's medium bodied, without much texture, but a clean, refreshing finish. ",Paul Jaboulet Aîné 2009 Secret de Famille Viognier (Vin de Pays des Portes de Méditerranée),85,18,France Other,Viognier
