,wine_alcohol,wine_category,wine_country,wine_description,wine_name,wine_point,wine_price,wine_region,wine_variety,year
1308,,Port/Sherry,Portugal,"Dry tannins and great concentration are followed by sweet fruits, damson juice and a rich core of powerful tannins. This intensity is lightened by the sweetness of black currants, but ultimately this impressive wine is dry. ",Churchill's 2007 Vintage  (Port),91,95,Port,Port, 2007
1309,14.0,Red,Portugal,"A Pombal is a dovecote (it's also the name of the Portuguese prime minister who created the Douro demarcation in 1756), and this wine comes from vines close to a dovecote on the Vesúvio estate. It shows smooth, opulent richness with the concentration of low yields. It has wonderful black fruits and a sweet, spicy tannin character. ",Quinta do Vesuvio 2007 Pombal do Vesúvio Red (Douro),92,28,Douro,Portuguese Red, 2007
1310,,Port/Sherry,Portugal,"Ripe and juicy, a wine that wears its heart on its sleeve. It is perfumed, with the 2007 freshness and a fine layer of nutmeg coming through the blackberry juice flavor. For medium-term aging. ",Quinta do Noval 2007 Vintage  (Port),92,100,Port,Port, 2007
1311,,Port/Sherry,Portugal,"Finely tannic, this is a solid wine, full of dark fruit skins, dry, dense and impressive in structure. It shows every sign of aging potential, from its solid tannins to its tight, red berry fruits and black fig flavors. ",Ramos-Pinto 2007 Vintage  (Port),92,90,Port,Port, 2007
1312,,Port/Sherry,Portugal,"A ripe wine, firmly structured. It has density, firm, dry tannins to go with black currant fruits and considerable acidity. An impressive wine, the tannins offering long aging. ",Martinez Gassiot 2007 Vintage  (Port),92,56,Port,Port, 2007
1313,,Port/Sherry,Portugal,"Pisca vineyard is a recent purchase by Niepoort, although the company has bought fruit there for many years. This is a first as a single quinta wine, softer than the Niepoort vintage, immediately attractive, finely balanced. It has structure and sweet fruit. ",Niepoort 2007 Pisca Vintage  (Port),92,100,Port,Port, 2007
1314,,Port/Sherry,Portugal,"Made by Niepoort for importer Broadbent Selections, this is a structured wine, showing dry tannins and density. The fruit is all there as well, offering fresh acidity, crushed raspberries and red plums. Alongside the ripeness, there is a dry core of tannin. ",Broadbent 2007 Vintage  (Port),92,69,Port,Port, 2007
1315,,Port/Sherry,Portugal,"An elegant, restrained wine, from young winemaker Oscar Quevedo. It's the balance between the sweet fruit, the tannins and acidity that make this wine. And there is a final dry, firm, tough burst that promises aging. ",Quevedo 2007 Vintage  (Port),92,50,Port,Port, 2007
1316,,Port/Sherry,Portugal,"A floral wine, offering dusty tannins to go with its sweet crushed strawberry flavors. There are spice and black fig flavors as well as elegance—a sense of proper restraint just waiting to power out in maybe 10 years. At the moment, it is all fruit, but over time it will show more structure. ",Warre's 2007 Vintage  (Port),93,73,Port,Port, 2007
1317,,Port/Sherry,Portugal,"A first vintage Port for José Maria Soares Franco, the man behind the legendary Douro table wine Barca Velha. He has teamed up with J. Portugal Ramos, better known in the Alentejo. This is beautifully perfumed Touriga Nacional, followed by fine and ripe tannins. A layer of acidity gives the wine a more dry, serious side. Powerful and intended for aging. ",Duorum 2007 Vintage  (Port),93,60,Port,Port, 2007
1318,,Port/Sherry,Portugal,"This big, firm wine, produced by the team that makes Dow's and Graham's Port, is as impressive as always. With its tight plum skins and dense character, ripe jammy texture and sweet fruit, it combines immediate charm with the potential for long-term aging. ",Quinta de Roriz 2007 Vintage  (Port),93,56,Port,Port, 2007
1319,,Port/Sherry,Portugal,"With its enticing perfumes, sweet plum and damson fruit flavors, this is initially a seductive wine. But at the same time, the vivid acidity and the strong tannic element suggest good aging potential. ",Offley 2007 Vintage  (Port),93,70,Port,Port, 2007
1321,,Port/Sherry,Portugal,"With its delicious juicy character, and blackberry jelly sweetness, this is a ripe wine, packed with fruit. It is sustained by a core of tannins and some herbal bitterness offering a good contrast to all the opulence and richness. ",Quinta do Vesuvio 2007 Vintage  (Port),94,74,Port,Port, 2007
1322,,Port/Sherry,Portugal,"A Port for aging, as you would expect from Graham's. The wine is dry, firm, textured, solid and dense. The fruit flavors of fresh cranberry and black currant are a supporting act at this stage. Classic vintage. ",W. & J. Graham's 2007 Vintage  (Port),95,90,Port,Port, 2007
1323,,Port/Sherry,Portugal,"Enticing violet and black currant aromas are followed by ripe plum and spice flavors. Maybe this isn't the most powerful Taylor Fladgate vintage ever, but it is balanced, opulent, beautifully made, the tannins fine, layered, with exquisite final acidity. ",Taylor Fladgate 2007 Vintage  (Port),95,95,Port,Port, 2007
1324,,Port/Sherry,Portugal,"Soft and juicy, showing the ripe heat of the Upper Douro. Sweet chocolate and fresh fruits balance well, supported easily by light tannins. It's easy, likely to develop relatively quickly. ",Quinta do Vale Meão 2007 Vintage  (Port),89,65,Port,Port, 2007
1326,17.0,Port/Sherry,Spain,"Dark brown in color, with sweet aromas of candied fruit, brown sugar and mocha. The palate is lively and warm, with zesty yet baked flavors of toffee, caramel and apricot. A little fiery and driving on the finish, with a lasting spice note. Excellent for an aged, dark-style Moscatel. ",Lustau NV Emilín Moscatel Sherry (Jerez),90,30,Andalucia,Sherry,
1327,19.5,Dessert,US,"Hames Valley is in the far southern part of Monterey County. It's a hot climate and perfect for ripening grapes. This Port-style wine, made from real Port grape varieties, is extraordinarily rich in blackberries, chocolate and caramel, with a residual sugar of 8.4%. Beautiful with chocolate and fruit pastries. ",Pessagno 2005 Hames Valley Vineyard Port (Hames Valley),90,36,California,Port, 2005
1328,,Port/Sherry,Portugal,"Obviously a Port for the long haul, not giving away much. There are flavors of licorice, bitter fruits, all-spice, nutmeg. The character at this stage is tight, edgy, but the promise is there and will be worth waiting for. ",Quinta Vale Dona Maria 2007 Vintage  (Port),90,90,Port,Port, 2007
1329,,Port/Sherry,Portugal,"Packed with strong, dusty tannins from beautifully ripe fruit, this is a wine that has structure, dark berry fruits, a solid chunky edge of black plum juice and great intensity. This could certainly age well. ",Cálem 2007 Vintage  (Port),90,48,Port,Port, 2007
1330,,Port/Sherry,Portugal,"An immensely tannic wine, dark and solid. The fruit at this stage is less apparent, with the spirit and structure dominant. A wine to watch as it develops, and probably for aging. ",Sandeman 2007 Vintage  (Port),90,75,Port,Port, 2007
1331,,Port/Sherry,Portugal,"On the dry side, firm and taut, with black currant tannins and a dense structure. This is a powerful, intense wine, cut through with acidity, finishing dry. ",Barros 2007 Vintage  (Port),90,49,Port,Port, 2007
1332,,Port/Sherry,Portugal,"Dry, firm, structured, its juiciness as much acidity as fruit. The wine is dense, still fresh, but definitely for the long haul. ",Kopke 2007 Vintage  (Port),90,60,Port,Port, 2007
1333,18.0,Port/Sherry,Spain,"Opening aromas of toffee and nuts are nice, but the nose falls off some and flattens out. Flavors of nuts, chocolate and caramel candy are typical of Cream Sherry but are not out of the ordinary, and the finish is underwhelming. Solid and more than decent, but not as pure and elevated as in the past. ",Bodegas Dios Baco S.L. NV Cream Sherry (Jerez),87,25,Andalucia,Sherry,
1334,,Port/Sherry,Portugal,"Smooth, ripe, perfumed and open, surprisingly easy at this stage. There are jammy black fruits, hints of toffee, the finish sweet and soft. ",Quinta do Portal 2007 Vintage  (Port),87,70,Port,Port, 2007
1335,,Port/Sherry,Portugal,"So soft, rounded, full of the ripest, easy fruit, a wine with an easy rolling gait. There are hints of wood, violet aromas and a velvet texture. ",Gould Campbell 2007 Vintage  (Port),87,56,Port,Port, 2007
1336,,Port/Sherry,Portugal,"Big, plump and fruity, soft and round. The fruit is ripe, sweet, layering black figs and black, spicy cherries. The wine is a charmer, a pleasure to drink now, but not for aging. ",Royal Oporto 2007 Vintage  (Port),87,39,Port,Port, 2007
1337,,Port/Sherry,Portugal,"With its dry, dark side, this wine offers firm tannins to go with the somewhat austere structure. Of course there is sweetness here and an attractive perfumed violet aroma, but the texture dominates. ",Croft 2007 Vintage  (Port),87,85,Port,Port, 2007
1338,18.0,Port/Sherry,Spain,"A good deal if you happen to like sweet but controlled Sherry. The nose is potent and nutty, with toffee and dried cheese. And the palate is lively and juicy, with flavors of burnt brown sugar, bitter chocolate, mushroom and lees. Dry enough, lush and tasting of toffee on the finish. ","Pedro Romero NV Full, Sweet Cream Sherry (Jerez)",88,13,Andalucia,Sherry,
1339,,Port/Sherry,Portugal,"Black fruit flavors with spicy aromas. The fruit is ripe, soft, the tannins coming through slowly. With black berry jam and well integrated spirits, this is already a ripe, juicy Port, probably not for aging. ",J. H. Andresen 2007 Vintage  (Port),88,47,Port,Port, 2007
1340,,Port/Sherry,Portugal,"The lighter vintage from Noval lives up to its style, well balanced, fresh, showing the fruitiness of the year. It is elegant, with everything already in balance. ",Quinta do Noval 2007 Silval Vintage  (Port),88,50,Port,Port, 2007
1341,16.0,Port/Sherry,Spain,"Cinnamon, nutmeg, a pinch of iodine and more spice than fruit on the nose. Flavors of brown sugar and toffee are satisfying, while the feel is fresh with no excess weight. Finishes with caramel, butter, toffee, coffee and pepper. A fit wine that's priced well. ","Pedro Romero NV Dark, Sweet Moscatel Sherry Moscatel (Jerez)",89,13,Andalucia,Moscatel,
1342,,Red,Portugal,"There is definite weight behind this intense wine. But it also has ripe, rich, deliciously sweet and juicy black fruits. It has structure as well, a series of sweet tannins and fresh acidity. It's the best red wine from the Dow's Quinta do Bomfim so far. ",Dow's 2007 Vale do Bomfim Red (Douro),89,12,Douro,Portuguese Red, 2007
1343,15.3,Red,US,"Starts out sulfury, and it's stubborn to blow off. Underneath is a softly sweet wine with jammy blackberry and coffee flavors that veer into raisiny Port. ",Peterson 2006 Bradford Mountain Vineyard Cabernet Sauvignon (Dry Creek Valley),81,35,California,Cabernet Sauvignon, 2006
1344,18.0,Port/Sherry,US,"Sweet in chocolate-covered cherries and crème de cassis, but turns a bit thin on the finish, and could use greater concentration, especially at this price. ",Von Strasser 2006 Petit Verdot Port (Diamond Mountain District),85,75,California,Port, 2006
1345,19.0,Dessert,US,"Very, very sweet, with exotic flavors of honey, black cherry liqueur, raspberry tart, white chocolate, butterscotch, vanilla cream and cinnamon spice, balanced with crisp acidity. In other words, delicious. ",Guenoc 2006 Serpentine Meadow Port Petite Sirah (Guenoc Valley),92,25,California,Petite Sirah, 2006
1346,17.6,Dessert,US,"Made from Portuguese varieties, this is an extraordinarily sweet wine. It's explosive in chocolate truffle, blackberry pie filling, caramel and smoky butter flavors, balanced with crisp acidity. Delicious and compelling. ",Used Automobile Parts 2005 Old World Style Port (Amador County),93,42,California,Port, 2005
1347,14.3,Red,US,"Soft and sugary sweet, almost a Port-style dessert wine. Finishes with a sweet-and-sour cherry sauce taste. ",Grizzly Republic 2005 Barbera (Amador County),81,35,California,Barbera, 2005
1348,15.0,Red,US,"Way too overripe, sweet and hot, basically a Port-style wine. It has flavors of shrivelled blackberries, raisins and sugared currants. ",San Marcos Creek 2005 Estate Cabernet Franc (Paso Robles),82,28,California,Cabernet Franc, 2005
1349,14.5,Red,US,"Very soft and melted, with hot flavors of grilled berries, cocoa and oak, leading to an astringent finish. Feels like a Port, except it's dry. ",San Antonio 2006 Cask 520 Red (Paso Robles),83,30,California,Bordeaux-style Red Blend, 2006
1350,16.4,Red,US,"As hot and sweet as an inexpensive Port, with sugary flavors of blackberries, chocolate and coffee. Okay for a dessert wine, inappropriate for a table wine. ",Minassian-Young 2007 Raison d'Etre Zinfandel (Paso Robles),83,25,California,Zinfandel, 2007
1351,15.5,Red,US,"Robust and hot, a fierce, peppery wine whose high alcohol frames ultraripe flavors of currants and raisins. Almost like a Port, except it's fully dry. ",Wilson 2007 Molly's Vineyard Zinfandel (Dry Creek Valley),83,32,California,Zinfandel, 2007
1352,15.6,Red,US,"Hot in high alcohol, with Port-like flavors of superripe currants and dark chocolate, finished with a raisinskin bitterness. ",Wilson 2007 Carl's Vineyard Zinfandel (Dry Creek Valley),83,32,California,Zinfandel, 2007
1353,,Port/Sherry,Portugal,"Very fresh, juicy, sweet fruited wine, underpinned by velvet tannins. It is attractive, approachable, only just hinting at weight and structure. ",Barão de Vilar 2007 Vintage  (Port),86,53,Port,Port, 2007
1355,15.6,Red,US,"Ultra-soft and a bit hot from high alcohol, this red wine is made in the modern cult style. It tastes of melted milk chocolate, blackberry jam, cassis and smoky new oak, with a hint of Port. ",Viansa 2005 Ossidiana Red (Sonoma County),87,125,California,Bordeaux-style Red Blend, 2005
1356,15.2,Red,US,"Big in flavor, with blackcurrant, cherry pie and cocoa flavors that finish with a bit of raisiny Port. Yet the wine is fully dry, and appeals for its classically elegant tannic structure. Drink now. ",Big Fish 2006 Zinfandel (Dry Creek Valley),87,42,California,Zinfandel, 2006
1357,18.0,Port/Sherry,US,"For an after-dinner sipper, the last drink of the night, try this sweetly soft, liqueury dessert wine. The intense flavors are of cassis, anisette, Kahlua and caramel. There's something sexy and sensual about the pure velvet mouthfeel. ",Miraflores NV Black Muscat (Amador County),92,38,California,Black Muscat,
1358,,Red,US,"Too heavy and overripe, with raisiny, pruney flavors that approach Port, although the wine is dry. Feels hot and tannic. Mainly Syrah, with Cabernet Sauvignon. ",Vihuela 2007 Incendio Red (Paso Robles),82,30,California,Red Blends, 2007
1361,,Dessert,US,"Sweet and fairly simple, a Port-style blend of Cabernet Sauvignon and Syrah that features sugary blackberry and chocolate flavors. ",Roxo Port Cellars 2005 Magia Preta Cabernet Sauvignon-Syrah (Paso Robles),84,75,California,Cabernet Sauvignon-Syrah, 2005
1365,,Dessert,US,"The grapes are Bordeaux varieties, but this is a ruby Port-style dessert wine. It's sweet and decadent in chocolate, blackberry tart, vanilla and smoky caramel flavors. Feels rich and fine in the mouth. ",Roxo Port Cellars 2006 Paso Melange Red (Paso Robles),90,44,California,Bordeaux-style Red Blend, 2006
1366,14.9,Red,US,"Almost as sweet as Port, but not as good, with a hot, harsh mouthfeel. Shows burnt flavors of cherries and blackberries, and is deficient in balancing acidity. ",Rosenblum 2006 Carla's Reserve Zinfandel (Contra Costa County),82,30,California,Zinfandel, 2006
1367,14.7,Red,US,"Too sweet, with jellied flavors of cherries and black raspberries. Almost like a ruby Port. ",Merriam 2006 Jones Vineyard Cabernet Franc (Dry Creek Valley),82,45,California,Cabernet Franc, 2006
1368,14.8,Red,US,"Smells and tastes like cheap Port, with burnt berry, chocolate and caramel notes. Yet it finishes dry and harsh. ",Rosenblum 2006 Aparicio Zinfandel (Amador County),82,25,California,Zinfandel, 2006
1369,14.8,Red,US,"Tastes like a sweet-and-sour cherry candy, with the acidity of a young ruby Port. Finishes with melted chocolate. ",Rosenblum 2006 Maggie's Reserve Zinfandel (Sonoma Valley),83,45,California,Zinfandel, 2006
1371,19.0,Port/Sherry,US,"Very sweet and ripe, with blackberry jam, cassis, dark chocolate and peppery spice flavors. Could use greater structural integrity and complexity, but it's a delicious dessert wine. ",Renwood 2004 Vintage Port (Sierra Foothills),86,35,California,Port, 2004
1372,15.5,Port/Sherry,Spain,"More yellow than Lustau's manzanilla, Jarana is a lovely, proper fino with a nose of iodine, lemon blossom and popcorn. The palate is staunch and doesn't back down; the high-toned nut and citrus flavors seem classic and elevated. And the finish is intense and frames everything in walnut oil and toast. ",Lustau NV Light Fino Jarana Sherry (Jerez),89,17,Andalucia,Sherry,
1373,18.0,Port/Sherry,Spain,"Nicely done and racy for an oloroso, with quince, baked peach and honey on the nose and then apricot and mocha flavors taking over in the mouth. Arguably a bit acidic, but that only helps to propel it toward an orange-tinged finish that's natural, sheer and clean. ","Pedro Romero NV Full, Dry Oloroso Sherry (Jerez)",89,13,Andalucia,Sherry,
1374,15.0,Port/Sherry,Spain,"Add Aurora to your list of dry Sherries that won't steer you wrong. It is a concentrated, slightly more powerful style of manzanilla with pear, pepper and rosemary aromas as well as a true, refined palate. Flavors of fresh mushroom and nuts are dry and just fruity enough. Like a kiss from the sea. ",Pedro Romero NV Aurora Manzanilla Extra Dry Sherry (Jerez),89,13,Andalucia,Sherry,
1375,,Red,US,"The 2005 vintage was quite a good one for Beaulieu Cabernets, including this dark, showy bottling. It's full-bodied and dry, with flavors of plums, cherries and cassis, and a velvety touch of chocolate Port on the finish. ",Beaulieu Vineyard 2005 Number 1 Cabernet Sauvignon (Rutherford),90,65,California,Cabernet Sauvignon, 2005
1376,15.0,Port/Sherry,Spain,"A medium to rich style of fino, with mild oxidation and aromas of vanilla, resin and dusty white fruits. The palate has a very nice texture to it, and the flavors of dry banana and lightly salted nuts are just right. A pure, convincing wine that proves that Dios Baco is a Sherry producer worth turning to. ",Bodegas Dios Baco S.L. NV Fino Sherry (Jerez),90,18,Andalucia,Sherry,
1377,18.0,Port/Sherry,Spain,"What a treat it is to come across an inexpensive Sherry that's this well made and delivers this much purity along with moderate richness. The wine smells very healthy, with nary a flaw. Toffee, peach and almond flavors are the slightest bit buttery, and the feel is lively but comfortable. ","Pedro Romero NV Dry, Rich Amontillado Sherry (Jerez)",90,13,Andalucia,Sherry,
1378,15.5,Port/Sherry,Spain,"Textbook Manzanilla! Papirusa is a clean, mildly salinic offering with green banana and toast aromas. The palate is just salty enough, but the wine's more about almond, apple and lemon peel than saline. And the feel and finish are nutty and warm. A full-bodied but refreshing style as only Lustau can do. ",Lustau NV Light Manzanilla Papirusa Sherry (Jerez),90,17,Andalucia,Sherry,
1379,17.0,Port/Sherry,Spain,"Pure and intoxicating on the bouquet, with lush, primal aromas of molasses and raisin. So rich and black that you almost need a knife to get through it, but it's not sludge in a glass. There's fudge, cocoa and mocha on the finish, yet as a whole it's an upright sweet wine, not something pudgy and simple. ",Bodegas Dios Baco S.L. NV Oxford 1.970 Pedro Ximénez (Jerez),91,20,Andalucia,Pedro Ximénez,
1380,15.5,Port/Sherry,Spain,"Immediately this strikes you as being elegant and refined. The nose is perfectly round, with oily, semi-rich aromas of baked fruits and almonds. The palate has more fruit and intensity than 99% of the finos out there, but there's also a backdrop of nut, mushroom and dried apple that stands out before exploding in front of a smooth, stately finish. ",Lustau NV Almacenista Fino del Puerto Sherry (Jerez),92,27,Andalucia,Sherry,
1381,18.5,Port/Sherry,Spain,"Extremely smooth and inviting from the beginning through the midsection and onto the finish. Toffee and warm cobbler aromas start it off and lead to a textured, elegant palate with toasty, nutty flavors and a pinch of salt. The finish is robust, and at all points it's a take-charge wine. An amontillado for connoisseurs and anyone eager to enjoy the finer points of the style. ",Lustau NV Almacenista Amontillado del Puerto Sherry (Jerez),92,42,Andalucia,Sherry,
1382,20.0,Port/Sherry,Spain,"Just add this oloroso to the growing list of excellent Sherries from Lustau. This one is tellingly nutty on the nose, thus the hazelnut and walnut flavors are expected as they become part of a bigger painting that includes coffee, bitter chocolate and baked fruits. Warming and charming, with subtle acidity. Very elegant and refined. ",Lustau NV Almacenista Oloroso Pata de Gallina Sherry (Jerez),92,42,Andalucia,Sherry,
1383,15.0,Port/Sherry,Spain,"The packaging seems a little old school, but the wine inside the bottle more than holds its own. The nose is pure and rich, like molasses. And there are no weaknesses in the mouth, where chocolate, brown sugar and prune flavors dominate. Broad through the finish, but never clumsy. An excellent sweet wine from Spain. ",Navarro NV Pedro Ximénez (Montilla-Moriles),92,24,Andalucia,Pedro Ximénez,
1384,19.7,Dessert,US,"A fine vintage Port-style wine, rich in chocolate-infused cassis flavors. Feels softly plush and velvety, and is very sweet. Nice way to end a meal with a chocolate dessert. ",Summit Lake 2002 Clair Riley's Pirate Reserve Port Zinfandel (Howell Mountain),92,45,California,Zinfandel, 2002
1385,17.0,Port/Sherry,Spain,"With piercing aromas of raisin pudding, molasses and spice, this rolls out the welcome mat and more. Luscious is probably as tame as you can put it; this is a ribald sweet wine with acidic backbone and hugely intense flavors of baked brown sugar, cinnamon cake and molasses. Powerful but still racy due to bracing acidity. About as good as it gets with P.X. ",Lustau NV San Emilio Pedro Ximénez Sherry (Jerez),93,33,Andalucia,Sherry,
1386,18.0,Port/Sherry,US,"Intensely sweet and super-drinkable, this Sherry-style wine has a light, creamy texture with potent flavors of white chocolate, raspberry honey, tangerine zest, vanilla crème brûlée and dusty spices. It's a gorgeous wine, a perfect way to end a great dinner with dainty little dessert pastries. ",Galleano NV Sherry Crema Cask III Sherry (Cucamonga Valley),93,25,California,Sherry,
1387,19.0,Port/Sherry,Spain,"A beautiful style of elevated Sherry that's worth every cent if fine Sherry is to your liking. The nose is pure toffee, roasted nuts, apricot and mellow quince, while the key flavor is dried orange and the nuances hinted at by the aromas all reappear. Muscular but in perfect shape, with a finish as smooth as glass. ",Lustau NV Almacenista Palo Cortado de Jerez Sherry (Jerez),94,42,Andalucia,Sherry,
1388,15.1,Red,US,"With high alcohol, this wine smells and tastes like Port, with caramelized flavors of black currants and dark chocolate. Finishes hot. ",Lava Cap 2005 Granite Hill Reserve Petite Sirah (El Dorado),82,30,California,Petite Sirah, 2005
1389,18.5,Dessert,US,"This sound, Port-style wine is made from Zinfandel. It shows briary flavors of wild red and black berries, milk chocolate and Christmas plum pudding, with spices of cinnamon, anise and nutmeg. Could use greater structure, as it's a bit soft. ",Bradford Mountain 2005 El Grandote Zinfandel (Dry Creek Valley),86,30,California,Zinfandel, 2005
1390,15.5,Red,US,"So soft and sweet in fruity, chocolaty richness, it's almost like a Port, without the fortification, although the alcohol is a high 15.5%. The tastes are of melted chocolate and cherry pie filling, spiced with cinnamon, nutmeg, salt and pepper. ",Pride Mountain 2006 Syrah (Sonoma County),87,60,California,Syrah, 2006
1391,14.6,Red,US,"Tastes as sweet as Port, with chocolate, currant and raisin flavors wrapped into smooth tannins. ",Opolo 2005 Petit Verdot (Paso Robles),83,39,California,Petit Verdot, 2005
1392,14.1,Red,US,"Shows very ripe black currant flavors that veer into raisins and prunes, while the smoky oak adds a caramelized layer that makes the wine taste Port-like. But it's dry, with crisp acids. ",San Simeon 2005 Syrah (Monterey),84,24,California,Syrah, 2005
1393,14.5,Red,US,"Marred by a superripeness that pushes it into Port territory, although it's thoroughly dry, this Merlot has flavors of currants and chocolate-covered raisins. It's also over-oaked, with a caramelized taste. ",Krupp Brothers 2005 Stagecoach Vineyard Merlot (Napa Valley),84,60,California,Merlot, 2005
1394,14.3,Red,US,"Sweet, with pie-filling blackberry, cherry, cinnamon and spice flavors. There's some heat, too, giving the wine a Port-like feel. ",Midnight 2005 Full Moon Red (Paso Robles),84,14,California,Red Blends, 2005
1395,13.5,Red,Portugal,"A new joint venture between winemaker Jorge Moreira and owner the Bergqvist family, both of Quinta de la Rosa. The vineyard is in the remote Douro Superior. You can certainly smell the dry heat in this young wine. To taste it has a Port-like smoothness overlying its dry tannins. The fruit is sweet, succulent, layered with blackberry jam and dark berries. ",Quinta das Bandeiras 2005 Passagem Red (Douro),88,28,Douro,Portuguese Red, 2005
1396,20.0,Dessert,US,"This Port-style dessert wine is a blend of Petite Sirah, Zinfandel and Syrah. It's sweet and rich, with chocolate-covered cherry, crème de cassis and currant flavors set off with a spicy, caramel and nougat finish. Feels smooth in the mouth, with crisp acidity for balance. ",Stephen & Walker 2004 Portentious Red (Mendocino),90,65,California,Red Blends, 2004
