wine_alcohol,wine_category,wine_country,wine_description,wine_name,wine_point,wine_price,wine_region,wine_variety
N/A,Port/Sherry,Portugal,"As so often, Niepoort comes through with a fabulous wine. It is dry and structured, with mature flavors that suggest there are wines in the blend that are older than 10 years. There is a bitter chocolate character, intense bitter almonds and finishing freshness and acidity. The whole comes in a concentrated, intense package. ",Niepoort NV 10-year old tawny  (Port),93,44,Port,Port
N/A,Port/Sherry,Portugal,"A dark, concentrated wine, very impressive. But with all this concentration, there is also sweet fruit, flavors of apricots that have been bottled in spirits. This is a lovely wine, with just a hint of mature, medicinal character. Imported by Premium Port Wines, Inc. ",Dow's NV 40-year old tawny  (Port),93,148,Port,Port
N/A,Port/Sherry,Portugal,"Always one of the best 20-year-olds, and this is no exception. The secret is in the velvet-like smoothness, which combines with a balanced mix of fig and caramel flavors, just a touch of burnt vanilla and the sort of acidity that makes you want another glass. Delicious. ",Ferreira NV Duque de Bragança 20-year old tawny  (Port),94,70,Port,Port
N/A,Port/Sherry,Portugal,"An old, mature wine, but one that has kept its ripeness and richness. The concentration is so intense that one glass is almost enough (except it tastes so good). There are walnuts, bitter chocolate and a delicious clean aftertaste. Imported by Premium Port Wines, Inc. ",W. & J. Graham's NV 40-year old tawny  (Port),94,152,Port,Port
N/A,Port/Sherry,Portugal,"This is a sweet but deliciously mature wine that exudes the richness of its burnt orange flavors, layers of sweet toffee, and clean, hugely rich aftertaste. A great wine. Imported by William Grant & Sons, Inc. ",Quinta do Noval NV 40-year old tawny  (Port),94,125,Port,Port
N/A,Port/Sherry,Portugal,"This wine comes from a wildly remote vineyard high in the Upper Douro. It is a fine, balanced wine, packed with acidity to balance the sweetness. It's relatively soft and gentle, with good, fresh flavors of figs. ",Ramos-Pinto NV Quinta Ervamoira 10-year old tawny  (Port),89,41,Port,Port
N/A,Port/Sherry,Portugal,"This is dry, with burnt aromas. The palate is very concentrated, packed with bitter fruits and hints of lemon. A sipping Port, just ready for contemplation. ",Poças NV 30-year old tawny  (Port),89,60,Port,Port
N/A,Port/Sherry,Portugal,"A big, sweet, soft wine, with lively fruit, some bitter coffee and sweet treacle flavors. This is an elegant, attractive wine. ",Churchill's NV 20-year old tawny  (Port),89,51,Port,Port
N/A,Port/Sherry,Portugal,"Great ripe fruits dominate this young, fresh wine. There is balancing sweetness and delicate, lightly burnt acidity. Now under the same management as Taylor and Fonseca, Croft is a name that should be as well known for Port as for Sherry. ",Croft NV 10-year old tawny  (Port),89,30,Port,Port
N/A,Port/Sherry,Portugal,"More in the elegant style, this Delaforce wine shows plenty of ripe flavors, but then restrains them. It is very pure, a delightful wine that is very drinkable. ",Delaforce NV 20-year old tawny  (Port),89,35,Port,Port
N/A,Port/Sherry,Portugal,"Dry, with some burnt character, this 40-year old from one of the companies owned by Barros also has great sweet fruit, lime marmalade and layers of acidity. It's well in balance, leaving acidity to finish. Imported by Frontier Wine Imports. ",Feist NV 40-year old tawny  (Port),89,150,Port,Port
N/A,Port/Sherry,Portugal,"A smooth, ripe, caramel- and toffee-flavored wine, with sweet fruit. Tastes young for a 20-year old, this still has good structure and is well integrated. ",Offley NV 20-year old tawny  (Port),89,48,Port,Port
N/A,Port/Sherry,Portugal,"There is plenty going on in Noval's 20-year-old. It is a dry style, but the generous fruit combines marmalade and fresh citrus flavors, along with powerful ripeness. Acidity is there too, giving a lift at the end. ",Quinta do Noval NV 20-year old tawny  (Port),89,60,Port,Port
N/A,Port/Sherry,Portugal,A fresh delicate wine. It has a fine array of orange flavors and a light touch of acidity and caramel. ,Dow's NV 20-year old tawny  (Port),89,50,Port,Port
N/A,Port/Sherry,Portugal,"From property owned by the Kopke and Van Zeller families (Fernando van Zeller is Baron de Vilar), this classically attractive 10-year style has deep gold/brown color and is ripe and almost sweet (but with just enough dryness). It also has freshness, young fruit flavors and just a hint of an attractive, burnt character. To find a fine example of a 10-year-old, look no further. ",Barão de Vilar NV 10-year old tawny  (Port),90,26,Port,Port
N/A,Port/Sherry,Portugal,"This is a hugely dry, burnt style, very concentrated. The licorice and bitter coffee flavors are dense, layered and well balanced with the acidity. A serious wine that demands attention. ",W. & J. Graham's NV 20-year old tawny  (Port),90,52,Port,Port
N/A,Port/Sherry,Portugal,"Although this famous name has produced quite a light 20-year-old, that lightness is more than made up for by the beautiful, smooth flavors, the taste of lemon jelly, dried apricots and peaches, and fine, fresh acidity. ",Taylor Fladgate NV 20-year old tawny  (Port),90,53,Port,Port
N/A,Port/Sherry,Portugal,"While it is quite dark in color, this wine still has plenty of good, 10-Year Oldfresh fruit flavors. Perfumed and delicate, it has light sweetness and a good layer of fruit and wood acidity, leaving a dry aftertaste. Its quality is an indication of the impressive improvements that have occurred at Royal Oporto in recent years. ",Royal Oporto NV 10-year old tawny  (Port),90,29,Port,Port
N/A,Port/Sherry,Portugal,"Warre's seems to have found just the right formula for its tawnys. The 10-Year OldOtima is a fine wine, and so is this Otima 20. It has aromas of almonds, layers of acidity and sweetness, the flavor of bitter oranges, and a round, ripe aftertaste. ",Warre's NV Otima 20-year old tawny  (Port),90,42,Port,Port
N/A,Port/Sherry,Portugal,"An attractively dry style of wine, with a concentrated inner core of firm acid and lightly burnt flavors. It has intensity, along with good fruitiness. This lesser brand of the Symington group is worth seeking out, both for its quality and for its good value. ",Gould Campbell NV 10-year old tawny  (Port),90,24,Port,Port
N/A,Port/Sherry,Portugal,"A hugely rich, sweet wine, full of concentration and very ripe fruit flavors. This is the classic Fonseca style, all richness and depth of flavor. There's power here, but it is all clothed in acidity and great fruits. ",Fonseca NV 10-year old tawny  (Port),90,30,Port,Port
N/A,Port/Sherry,Portugal,"This is a finely balanced, rich but elegant wine, from a company owned by Sogrape, Portugal's largest wine producer. There is some good burnt caramel flavor, as well as ripe fruit, and a delicious, just lightly fresh aftertaste. ",Offley NV 30 Year Old Tawny  (Port),90,108,Port,Port
N/A,Port/Sherry,Portugal,"An impressively concentrated wine from this firm owned by Barros. There's a dark toffee flavor that runs parallel to fine acidity throughout. The aftertaste is fresh, but still full of concentration. ",Feist NV 30-year old tawny  (Port),90,98,Port,Port
N/A,Port/Sherry,Portugal,"A dense, concentrated, but deliciously clean wine, with balanced fruit, marmalade flavor and a touch of spirit to finish. This is a wine that shows considerable character and style. ",Wiese & Krohn NV 20-year old tawny  (Port),90,50,Port,Port
12.5%,White,Portugal,"The aromas are attractively fresh, while the palate is more towards full, fat fruits. So the green perfume gives way to melon and pear only just touched by citrus acidity. Treat this as a food wine, not an apèritif. This wine was formerly sold under the Cockburn Port brand. ",Symington Family Estates 2007 Tuella White (Douro),84,13,Douro,Portuguese White
14.5%,Red,US,"Dry, soft and quite tannic, this red blend has berry-cherry flavors that veer into overripe raisins and Port. Made from Petite Sirah, Syrah and Barbera. ",Heringer 2006 Purple Thread Library Reserve Red (Clarksburg),84,40,California,Red Blends
18%,Dessert,Greece,"This oak-aged, Port-like red has a round character of vanilla and coffee paired with sweet spice. Its balance of smoky/sweet flavors are exotic and thought-provoking and beg for aging. ",Tsantali NV Cellar Reserve  (Mavrodaphne of Patras),87,13,Mavrodaphne of Patras,Mavrodaphne
N/A,Port/Sherry,Portugal,"Great depth of flavor with fruit and a layer of mature almond nuttiness. The wine shows some wood, but also dried figs, prunes and some mature acidity. Not quite dry, but edging in that direction. ",Rozes NV White Reserva  (Port),89,20,Port,Port
14.2%,Red,US,"Sweet and candied, with pie-filling cherry and blackberry flavors. Tastes almost like a dessert wine or inexpensive Port. ",Truchard 2005 Merlot (Carneros),84,28,California,Merlot
20%,Port/Sherry,Portugal,"A 10-year-old that tastes older than its indicated age. There is a strong wood-aged feel to it, the toast and vanilla from wood coming through well. It is also on the dry side, giving it spice rather than molasses. The finish is dense, concentrated. ",Gilberts NV 10-Year-Old Tawny  (Port),89,10,Port,Port
19.5%,Port/Sherry,Portugal,"With its age, this has developed complexity and subtlety, very much a hallmark of the elegant Ramos-Pinto style. The wood flavors are evident, not quite dominant, leaving room for bitter orange and spice along with acidity that could come either from the aging or the fruit. The finish is properly long, fading gracefully. ",Ramos-Pinto NV Porto 30 Years  (Port),92,109,Port,Port
16%,Red,US,"Tastes sweet and hot, like an inexpensive Port, with sugary cherry-berry jam flavors. The official alcohol is 16%. ",Mazzocco 2006 Warm Springs Ranch Zinfandel (Dry Creek Valley),82,32,California,Zinfandel
15%,Port/Sherry,Spain,"Perfectly good manzanilla for casual sipping. The nose is light, pure and offers echoes of pear and blanched almonds. Dry and elegant, with apple, salt and minerally flavors, the palate is complete and mouthfilling. Finishes with length. ",Pedro Romero NV Extra Dry Manzanilla Sherry (Jerez),88,13,Andalucia,Sherry
16.7%,Red,US,"As sweet as Port, with chocolate and prune flavors. Feels as hot as a chile pepper, with nearly 17% alcohol. ",Mazzocco 2006 Reserve West Dry Creek Zinfandel (Dry Creek Valley),81,50,California,Zinfandel
14.5%,Red,Portugal,"With Port-like aromas, this is a concentrated wine that revels in spicy wood as well as sweet black plum and black fig flavors. The wine is dry, but it really wants to be sweet, the tannins soft and easy. The Porty character persists, suggesting very ripe fruit. ",Churchill's 2007 Churchill Estates Reserva Red (Douro),87,28,Douro,Portuguese Red
N/A,Port/Sherry,Portugal,"Firm and balanced, this spicy wine also shows layers of black currant and dark tannins. Its general character is firm and dry, the tannins giving a dominant structure, promising aging. ",Churchill's 2007 Quinta da Gricha Vintage  (Port),89,75,Port,Port
20%,Port/Sherry,Spain,"Attractive caramel, apricot and peach aromas drive straight to a pure, creamy palate of cinnamon apple, mocha, coffee and chocolate. It's quite smooth and balanced, and very long on the finish. Avoids all the pitfalls of sweet Sherry by maintaining its balance and mouthfeel. ",Lustau NV DeLuxe Cream Capataz Andrés Sherry (Jerez),91,20,Andalucia,Sherry
N/A,Port/Sherry,Portugal,"From a parcel of old vines around the quinta chapel, this is a stunning wine. It has all the opulence we expect from Vesuvio, along with a density that is rare in this vintage. The tannins are there, but are equalled by the toffee, ripe fruit, figs, sweet chocolate. The whole wine is lightened by acidity, but will obviously age. ",Quinta do Vesuvio 2007 Capela Vintage  (Port),95,125,Port,Port
N/A,Port/Sherry,Portugal,"Big and ripe, the tannins well behind the rich fruit character. It is full in the mouth, offering bright spice, acidity as well as blackberry juice flavors. There is a stalky, drier edge to the finish. ",Vista Alegre 2003 Late Bottled Vintage  (Port),88,15,Port,Port
N/A,Port/Sherry,Portugal,"Very fruity, with plenty of acidity, the black currant and sweet plums fitting well together. The wine has some firm tannins as well, but the character is more fruity and soft. ",Sandeman 2004 Late Bottled Vintage  (Port),88,32,Port,Port
N/A,Port/Sherry,Portugal,"A great caramel and dried raisin character, the wine showing figs and spice, touched by the spirit but not more. The end has dryness, a firm finish. ",Poças NV Special Reserve Tawny  (Port),88,19,Port,Port
N/A,Port/Sherry,Portugal,"A very dry wine, perfumed with violets and geranium aromas. The wine is firm, dark and dense, but that perfume is off-putting. The tannins though are impressive, solid and powerful. ",Quinta de Ventozelo 2003 Late Bottled Vintage  (Port),88,25,Port,Port
N/A,Port/Sherry,Portugal,"A spicy wine, the flavors layered with vanilla, giving it a smooth character, rich with sweet jelly flavors. There is a good core of tannin to balance. ",Kopke 2005 Late Bottled Vintage  (Port),88,24,Port,Port
N/A,Port/Sherry,Portugal,"Big, bold fruity wine, with plenty of black berry and sweet jam flavors. The wine has some tight tannins, but the velvet fruits are prominent, giving both density and directness. ",Offley 2005 Late Bottled Vintage  (Port),88,24,Port,Port
N/A,Port/Sherry,Portugal,"Sweet and deliciously ripe, the wine has floral perfumes, a soft character, even though the tannins are all there. A stalky final taste shows how young it is. It needs another year. ",Quinta do Portal 2005 Late Bottled Vintage  (Port),88,25,Port,Port
N/A,Port/Sherry,Portugal,"An austere wine with a stalky character, showing firm tannins and a strong mineral character of Douro schist. It is like a sweet table wine, spiced and structured, needing to age. ",Ramos-Pinto 2005 Late Bottled Vintage  (Port),89,26,Port,Port
N/A,Port/Sherry,Portugal,"A ripe wine, touched with caramel, plenty of spice and acidity as well as a tight, tannic edge. The start is sweet, but the wine soon veers drier, leaving acidity as well as the firmest tannins. ",Royal Oporto 2004 Late Bottled Vintage  (Port),89,15,Port,Port
N/A,Port/Sherry,Portugal,"This is drier than some 10-year-old Tawnys, showing a taste of wood, with acidity and the fig and raisin flavors behind the mature flavors. This is all suggests that much of the wine in the blend is older than 10 years, giving extra richness and depth of flavor. ",Poças NV 10-years old Tawny  (Port),89,30,Port,Port
N/A,Port/Sherry,Portugal,"A rich, extravagantly spicy wine, the fruit showing sweet raisins and dried figs. The tannins are soft and generous, with good ripe fruit. This is an open, soft wine. ",Quinta do Crasto 2005 Late Bottled Vintage  (Port),89,26,Port,Port
N/A,Port/Sherry,Portugal,"Dark in color, the wine has very rich fruit flavors spiced with cinnamon, tasting like Christmas coffee, the tannins firm, with a dry structure. Black plum skins dominate. ",Burmester 2005 Late Bottled Vintage  (Port),89,55,Port,Port
N/A,Port/Sherry,Portugal,"A ripe, fresh fruity wine, with richness from black plums, but also plenty of bright acidity. The wine is soft, the tannins hiding behind the rich fruit. ",Barão de Vilar 2003 Late Bottled Vintage  (Port),89,19,Port,Port
N/A,Port/Sherry,Portugal,"A firm, dry tannic wine, with a good dense structure. The fruit shows its edgy side, with fruit skins and fruit tannins. This has some aging potential—perhaps 4–5 years. ",Ferreira 2005 Late Bottled Vintage  (Port),89,25,Port,Port
N/A,Port/Sherry,Portugal,"A full-bodied wine, showing the richness and super-ripe grapes of 2003. It is soft, with dusty tannins showing through the ripe damsons and almost jammy character. It's all well in balance. ",Poças 2003 Late Bottled Vintage  (Port),90,26,Port,Port
N/A,Port/Sherry,Portugal,"Quite light, with acidity, fresh blackberry fruits and rather bitter tannins. There is an edge of final juiciness, but overall this seems rather harsh. ",Ferreira 2000 Late Bottled Vintage  (Port),86,25,Port,Port
N/A,Port/Sherry,Portugal,"The wine has little sign of age, but still misses out on weight and definition. It has a soft toffee and sweet character, with soft tannins and a final raisin taste. ",Smith Woodhouse 1995 Late Bottled Vintage  (Port),86,39,Port,Port
19.5%,Port/Sherry,Portugal,"The wine is soft, ripe, with a touch of maturity followed by good, tight wood tannins. The wine has a ripe character, quite full with hints of the wood aging as well as mature fruit. ",Poças NV Tawny  (Port),86,12,Port,Port
N/A,Port/Sherry,Portugal,"An elegant wine, its acidity showing through balanced black berry fruits. The wine has good spice along with a dry core of light tannins. ",C. da Silva 2004 Presidential Late Bottled Vintage  (Port),87,23,Port,Port
N/A,Port/Sherry,Portugal,"Showing freshness as well as sweet jelly fruit, this has a young feel to it. An edge of bitter chocolate and spice is layered over tannins that are not yet integrated. ",Ramos-Pinto 2004 Late Bottled Vintage  (Port),87,26,Port,Port
19.5%,Port/Sherry,Portugal,"This was bottled, unfiltered, in 2007, allowing aging in the bottle. It is structured, edging towards firm, the full stalky berry flavors still with fresh acidity despite the sweetness. ",Quinta do Crasto 2002 Late Bottled Vintage  (Port),87,26,Port,Port
N/A,Port/Sherry,Portugal,"Dry and solidly tannic, with hints of wood and spice. The fruit is stalky, juicy, with acidity as a constant presence. It is bright, but without great depth. ",Churchill's 2003 Late Bottled Vintage  (Port),87,33,Port,Port
N/A,Port/Sherry,Portugal,"Dry, with acidity, black currant flavors and tight tannins. The wine is freshened with spice and acidity, only just showing its sweetness with black jelly flavor at the end. ",Offley 2004 Late Bottled Vintage  (Port),87,24,Port,Port
N/A,Port/Sherry,Portugal,"A fruity, ripe wine, with berry fruits, soft tannins and primary fruit flavors. The wine has hints of raisins, as well as a ripe, juicy character. ",Barros 2005 Late Bottled Vintage  (Port),87,18,Port,Port
N/A,Port/Sherry,Portugal,"Rich and fruity, with open black fruits and soft tannins. The wine has jelly and sweet fruits, while the spirit is not yet fully integrated. ",Quinta Vale Dona Maria 2005 Late Bottled Vintage  (Port),87,28,Port,Port
N/A,Port/Sherry,Portugal,"A wine that tastes young, its tannins still fresh and dominant. The fruit is subdued, giving a more stalky character. Tight berry fruits come through the dry edge of spirit. ",Martinez Gassiot 2005 Late Bottled Vintage  (Port),87,20,Port,Port
19.5%,Port/Sherry,Portugal,"Very fresh fruit, somewhat stalky, with tannins that show a ripe character over good spice. The flavors of berry fruits and figs are easy, soft, finishing with attractive acidity. ",Poças NV Ruby  (Port),87,12,Port,Port
N/A,Port/Sherry,Portugal,"Rich and deep flavored, with good quality black fruits, spice and tannins. There is raisiny fruit, well integrated with spirit and tannins. It finishes full in the mouth, ripe. ",Poças NV Special Reserve Ruby  (Port),88,19,Port,Port
N/A,Port/Sherry,Portugal,"A firm wine, dry in style. The fruit is under the tannins, bitter chocolate, dark and brooding. If the spirit wasn't too obvious on the the finish, this would be an impressive wine. ",Warre's 2000 Late Bottled Vintage  (Port),88,62,Port,Port
N/A,Port/Sherry,Portugal,"A ripe, jammy, caramel style, with super-sweet fruit and spice followed by toast and fig jam. The wine is big, bold, opulent, finishing with bright berry flavors. ",Quinta da Gaivosa 2004 Late Bottled Vintage  (Port),88,20,Port,Port
N/A,Port/Sherry,Portugal,"A serious, impressive wine produced from a small parcel of old vines at Vargellas. With minerality, spice, dark black plums and a dense tannic structure, this is obviously ready for a long haul of aging. The tannins give an initial bitterness, but then the juicy, wonderfully ripe fruit comes in. ",Taylor Fladgate 2007 Quinta de Vargellas Vinha Velhas Vintage  (Port),96,230,Port,Port
N/A,Port/Sherry,Portugal,"An impressive, balanced wine from master winemaker Dirk van Niepoort. Chocolate and licorice flavors dominate the fruit, giving a wine that has weight, complexity and at the same time elegance. The tannins offer a dense, dry structure. It is tight, solid and certainly for aging. ",Niepoort 2007 Vintage  (Port),96,100,Port,Port
N/A,Port/Sherry,Portugal,"A solidly structured wine, packed with initially sweet fruit that then becomes drier as the ripe tannins show through. All the ingredients are there, supported by a tense texture to go with the first sweetness. It's an exciting wine, obviously very ageworthy. ",Dow's 2007 Vintage  (Port),96,76,Port,Port
N/A,Port/Sherry,Portugal,"Dense and serious, a powerful vintage, as would be expected from Fonseca. The whole emphasis of the wine pushes the tannins forward, but this structure is based on black plums with dark fruit skins and a solid, chunky character. The finish is juicy and bold. ",Fonseca 2007 Vintage  (Port),96,95,Port,Port
20%,Dessert,US,"Everything's nice about this dessert wine except for the thinness of flavor. It's honey-sweet, with firm tannins and a bracing jolt of warming alcohol, with sweet caramelization from wood. But the fruit is dilute. Needs greater concentration. ",Optima 2006 Orgaz Zinfandel Port (Dry Creek Valley),83,26,California,Port
14.2%,Dessert,US,"Made from a Portuguese variety, this Port-style wine has a residual sugar of 8%. The flavors veer toward blackberries and dark chocolate. It's also very tart. Yet it doesn't deliver enough richness, and it finishes hot. Your mouth longs for more fruit, richness, complexity. Drink now. ",Paraiso Vineyards NV Souzao Port (Santa Lucia Highlands),85,25,California,Port
20%,Dessert,US,"Ultra-sweet, with honeyed flavors of blackberries, currants, chocolate, anise and spices. Would score higher if it were more concentrated and complex. ",Benson Ferry 2003 Port (Lodi),86,30,California,Port
16%,Red,US,"Despite the “valley” appellation, this is one of the highest elevation vineyards in Sonoma County. It's a dense, tannic, concentrated wine, with a deep core of black currants, black pepper and chocolate. Zinfanatics will absolutely love it, but it's very high in alcohol, almost Port-like, although the finish is absolutely dry. ",Hanna 2006 Bismark Mountain Vineyard Zinfandel (Sonoma Valley),88,65,California,Zinfandel
18%,Port/Sherry,Australia,"Although this is fortified, it's not overly so, with the finished alcohol level resting around 18%. The result is a decadently sweet mash-up of brandy-macerated raspberries that turn chocolaty on the finish. Although it lacks the complexity, tannic grip and minerality of the best true Ports, it's a tasty drop nonetheless. Drink now-2025. ",D'Arenberg 2006 The Vintage Fortified Shiraz (McLaren Vale),90,40,South Australia,Shiraz
N/A,Port/Sherry,Portugal,"Lean and light in character, a wine that shows a very stalky style, the acidity and tannins dominant. ",Messias 2005 Late Bottled Vintage  (Port),84,15,Port,Port
20.5%,Port/Sherry,US,"Honey-sweet, with blackberry, cherry and caramel flavors. Yet it feels unyielding, offering the tease but not the follow-through of richness. Drink now. ",Robert Hall 2006 Vintage Port (Paso Robles),85,34,California,Port
N/A,Port/Sherry,Portugal,"A light wine from a wet year. The wine is soft, seemingly dilute. It has some red berry flavors, but not much texture or structure, with wood aging taste. ",Quinta da Prelada 2002 Late Bottled Vintage  (Port),85,30,Port,Port
19.5%,Port/Sherry,Portugal,"A fine, sweet, fresh Port, well integrated with the spirit. It has just a touch of acidity to give a good balance. ",Poças NV Pink Rosé  (Port),85,16,Port,Port
20%,Port/Sherry,US,"Sweet, with flavors of blackberry tart, dark chocolate, crème de cassis and cherry glacé. Could be firmer in acidity and more concentrated, but it's a pretty dessert wine. ",Bogle 2006 Port Petite Sirah (Clarksburg),86,18,California,Petite Sirah
N/A,Port/Sherry,Portugal,"A rich, toffee-like wine, fleshy and opulent, appealing in its generosity. Only after a while do the tannins show through, and even then the full-bodied character dominates. ",Dão Sul 2007 Quinta das Tecedeiras Vintage  (Port),91,55,Port,Port
N/A,Port/Sherry,Portugal,"As often happens, this lesser brand from the Symington Family Estates stable has produced an impressive vintage. It is structured, while also attractive, lively and fresh. There is a light layer of sweetness, the fruit bold and black, finishing with a fine, juicy aftertaste. ",Smith Woodhouse 2007 Vintage  (Port),91,56,Port,Port
N/A,Port/Sherry,Portugal,"Dry tannins and great concentration are followed by sweet fruits, damson juice and a rich core of powerful tannins. This intensity is lightened by the sweetness of black currants, but ultimately this impressive wine is dry. ",Churchill's 2007 Vintage  (Port),91,95,Port,Port
14%,Red,Portugal,"A Pombal is a dovecote (it's also the name of the Portuguese prime minister who created the Douro demarcation in 1756), and this wine comes from vines close to a dovecote on the Vesúvio estate. It shows smooth, opulent richness with the concentration of low yields. It has wonderful black fruits and a sweet, spicy tannin character. ",Quinta do Vesuvio 2007 Pombal do Vesúvio Red (Douro),92,28,Douro,Portuguese Red
N/A,Port/Sherry,Portugal,"Ripe and juicy, a wine that wears its heart on its sleeve. It is perfumed, with the 2007 freshness and a fine layer of nutmeg coming through the blackberry juice flavor. For medium-term aging. ",Quinta do Noval 2007 Vintage  (Port),92,100,Port,Port
