,wine_alcohol,wine_category,wine_country,wine_description,wine_name,wine_point,wine_price,wine_region,wine_variety,year
1934,20.0,Port/Sherry,Portugal,"Deep gold in color, this is a finely perfumed, toffee-rich wine, with a tannic edge, wood flavor, intense acidity and great concentration. It's a great example of aged tawny, and it's ready to drink now. ",Ramos-Pinto NV RP30 Tawny 30 Years  (Port),93,105,Port,Port,
1935,16.3,Red,US,"The alcohol on this Zin is enormous, giving it a Port-style headiness. But it sure is delicious, offering tiers of black currants, chocolate, sweet licorice and cedar. Defines this robust style of California Zin in a rich, barbecue-friendly way. ",De Paola Vineyard 2008 Emilio Zinfandel (Arroyo Grande Valley),87,29,California,Zinfandel, 2008
1936,16.1,Red,US,"So rich and soft with chocolate, raspberry and vanilla flavors, this wine is better sipped by itself than with food. The alcohol level is enormously high, giving this Cabernet the headiness of a Port. ",Raymond 2009 District Collection Cabernet Sauvignon (Calistoga),88,75,California,Cabernet Sauvignon, 2009
1937,14.5,Red,US,"This dark, dry, tannic wine is rich in blackberries and cherries, with earthy notes of mushrooms and herbs. It's pretty tight and astringent now, but should soften over the next 5–6 years. The blend is Tempranillo, Touriga Nacional and Souzão. ",PasoPort 2009 Vinho Tinto Red (Paso Robles),88,34,California,Red Blends, 2009
1938,15.9,Red,US,"So high in alcohol, it's almost like a Port, with heady, tannic flavors of blackberries, black currants, dark chocolate and sweet oak. You can drink it now with barbecue, but it should age the next 10 years with ease. ",Sbragia 2010 La Promessa Zinfandel (Dry Creek Valley),89,34,California,Zinfandel, 2010
1939,13.6,Red,US,"This variety is one of the traditional Port grapes. It should do well as a dry wine in the hotter areas of California, but no one has figured out how to make it happen. This bottling by Kenneth Voik does not advance the cause. The wine is heavy and dull. ",Kenneth Volk 2010 Pomar Junction Vineyard Touriga Nacional (Paso Robles),82,36,California,Touriga Nacional, 2010
1940,16.1,Red,US,"The texture is smooth and velvety on this Zinfandel, but the flavors are off. You'll find ripe blackberry jam and currants right next to overripe raisins. Enormously high alcohol makes this wine taste like a fruity, simple port. ",Hidden Oak 2010 Zinfandel (Monterey County),84,30,California,Zinfandel, 2010
1941,15.4,Red,US,"High alcohol sticks out on this wine, giving it a dry heat, while raisin flavors suggest a port-like overripeness. It's not going anywhere, so drink up. ",Kaleidos 2008 Halter Ranch Syrah (Paso Robles),84,40,California,Syrah, 2008
1942,,Port/Sherry,Portugal,"This opulent wine is very ripe. From Dow's flagship vineyard, it is a sweeter wine than many of its kind, showing a caramel note and soft tannins. Within all of its sweet fruit is a firm, dry, structured core. ",Dow's 2009 Quinta do Bomfim Vintage  (Port),93,48,Port,Port, 2009
1943,,Port/Sherry,Portugal,"A firm and very structured wine, this is for long-term aging. At this young stage, the fruit seems extracted, but this will pass as the weight of the dense damson skin and tannic character shines through. Complex and finally ripe. ",Duorum 2009 Vintage  (Port),93,80,Port,Port, 2009
1944,,Port/Sherry,Portugal,"This rich and juicy wine from the Pinhão Valley has enormous potential, as shown by its strong, tannic character and firm structure. The foot-trodden grapes lend great flavor intensity, fine concentration and a note of blackberry juice. It will age well. ",Wine & Soul 2009 Pintas Vintage  (Port),94,80,Port,Port, 2009
1945,,Port/Sherry,Portugal,"This ripe and full-bodied wine from Cristiano van Zeller is powerfully concentrated, showing all the right weight while also providing generous fruitiness. Rich black fruits and sweet tannins are layered with acidity. This is a wine for long-term aging. ",Quinta Vale Dona Maria 2009 Vintage  (Port),95,57,Port,Port, 2009
1946,,Port/Sherry,Portugal,"The concentration of old vines is very evident in this wine, which uses fruit that was sourced from a portion of old vines in Niepoort's Quinta da Pisca. There is a touch of bitter cherry, as well as a firm, dense core that shows a fine balance of acidity. This is powerful, full-bodied and packed with dark fruit—for long-term aging. ",Niepoort 2009 Bioma Vinha Velha Vintage  (Port),96,100,Port,Port, 2009
1947,14.8,Red,US,"This is heavy, soft and overripe, with raisin and Port-like flavors. ",Bianchi 2009 Petite Sirah (Paso Robles),81,22,California,Petite Sirah, 2009
1949,20.5,Dessert,US,"Made from traditional Port varieties, this wine is very sweet, and unfortunately there's not a lot going on beyond that. The blackberry and chocolate flavors need a lot more concentration to stand up to the residual sugar. ",Robert Hall 2008 Vintage Port (Paso Robles),85,36,California,Port, 2008
1950,15.0,Red,US,"High alcohol gives this wine prickly, peppery heat. Although it's dry, it's Port-like, with raisin, blackberry, white pepper, licorice and bacon flavors. Give it credit for sheer power. It will age, without ever losing its rustic character. ",Wine Guerrilla 2010 Monte Rosso Vineyard Block E44 Zinfandel (Sonoma Valley),87,42,California,Zinfandel, 2010
1951,16.0,Red,US,"Gigantic is just one word to characterize this Zinfandel. For starters, it's enormously high in alcohol—at 16% by volume, it's almost Port-like. Yet it's dry and smooth in tannins, and the heat gives a heady boost to the black currant, black pepper and sweet oak flavors. Not for everyone, but it defines this powerful Dry Creek style of Zin. ",Michael David 2010 Rage Zinfandel (Dry Creek Valley),88,59,California,Zinfandel, 2010
1954,14.7,Red,US,"An inaugural release from veteran winemaker Nils Venge, this wine contains small amounts of Merlot and Petit Verdot. It's very dry, quite tannic and rich, with flavors of black cherries, currants and new oak, with an earthy note that adds to the complexity. The mouthfeel is warm and almost Port-like. ",Pellet Estate 2010 Pellet Vineyard Cabernet Sauvignon (Napa Valley),93,85,California,Cabernet Sauvignon, 2010
1955,20.0,Dessert,US,"Made using classic Port grape varieties, this is rich and sweet, with chocolate, coffee, orange, plum and spice flavors. Crisp acidity provides needed balance. It shows a complexity that lifts it above the ordinary. Drink now–2015. ",Williams Selyem 2006 Mistral Port (Central Coast),93,40,California,Port, 2006
1956,16.0,Red,US,"This tastes sweet and hot, which gives the flavors of blackberry and raisin a Port-like character. ",Tin Barn 2010 Gilsson Vineyard Zinfandel (Russian River Valley),81,27,California,Zinfandel, 2010
1957,15.4,Red,US,"This Zinfandel tastes and feels hot and Port-like. While some people enjoy this style, it feels a bit clumsy and overripe. Nonetheless, the blackberry, raisin and chocolate flavors are tasty. ",Mazzocco 2010 Briar Zinfandel (Dry Creek Valley),82,32,California,Zinfandel, 2010
1958,16.4,Red,US,"The high alcohol gives this wine glycerine-driven sweetness and Port-like heat. With its raisin and chocolate flavors, this is Mazzocco's signature style. ",Mazzocco 2010 Smith Orchard Reserve Zinfandel (Dry Creek Valley),83,52,California,Zinfandel, 2010
1959,,Port/Sherry,Portugal,"This is a firm and powerful wine, chunky and dense. It has a solid edge of tannins, dark and dense, resulting in a mineral-structured wine that is both dry and likely to age for many years. ",Burmester 2010 Quinta de Arnozelo Vintage  (Port),89,70,Port,Port, 2010
1960,,Port/Sherry,Portugal,"Dense in color, this firm wine has a rich black-fruit character. There is a strong element of acidity, which brings out the natural fruitiness of the wine. At the same time, there is enough dense texture to promise aging. ",Cálem 2010 Vintage  (Port),89,60,Port,Port, 2010
1961,,Port/Sherry,Portugal,"While there are medicinal aromas, suggesting some new wood in the aging process, the flavors are of rich, ripe fruits. For medium-term aging. ",Quinta Nova de Nossa Senhora do Carmo 2009 Vintage  (Port),90,70,Port,Port, 2009
1962,,Port/Sherry,Portugal,"This is a big, fruity wine, packed with sweet, ripe fruit. There is a fine mineral texture to balance this richness, which gives it a severe edge and promises aging. ",Kopke 2009 Quinta de São Luiz Vintage  (Port),90,75,Port,Port, 2009
1963,,Port/Sherry,Portugal,"This is a perfumed wine with fine acidity. The tannins are soft, accompanied by black cherry and ripe berry notes, making this a sweet, rich style. The Quinta Senhora de Ribeira is on the north bank of the Douro, facing Quinta do Vesúvio on the south bank. ",Dow's 2010 Quinta Senhora da Ribeira Vintage  (Port),90,60,Port,Port, 2010
1964,,Port/Sherry,Portugal,"With firm and structured tannins, the wine has strong potential. It also has an element of blackberry juice that provides ripe fruit as well as acidity. There is a cool feel to this wine, with a dry finish. ",Warre's 2010 Quinta da Cavadinha Vintage  (Port),91,88,Port,Port, 2010
1965,,Port/Sherry,Portugal,"Better known for its table wines, Quinta do Crasto still retains an important Port program. This big, dry and smoky effort fully justifies that. It is firmly structured and tannic, with a strong black-pepper character that is balanced by the solid structure and concentration.  Age over many years. ",Quinta do Crasto 2010 Vintage  (Port),91,78,Port,Port, 2010
1966,,Port/Sherry,Portugal,"This is intensely perfumed, with soft tannins that are followed by a dry, concentrated character. From the iconic Vesúvio Vineyard, where wines for vintage production are still foot trodden, this has a ripe feel, with tannins that are suitable for medium-term aging. ",Quinta do Vesuvio 2010 Vintage  (Port),91,65,Port,Port, 2010
1967,,Port/Sherry,Portugal,"On the north bank of the river, the remote Quinta dos Canais has produced a ripe, richly textured, perfumed wine that's packed with sweet berry flavor. It is concentrated, complete and softly tannic, suggesting medium-term aging. ",Cockburn's 2010 Quinta dos Canais Vintage  (Port),91,50,Port,Port, 2010
1968,,Port/Sherry,Portugal,"A smooth, rich, almost toffee-flavored wine, this has ripe black-plum and raisin notes, with hints of pepper and dark chocolate. From what has become Cockburn's flagship quinta, this is a delicious wine for  medium-term aging. ",Cockburn's 2009 Quinta dos Canais Vintage  (Port),92,50,Port,Port, 2009
1969,,Port/Sherry,Portugal,"This firm, perfumed, dry wine has concentrated spice and raisin flavors. Owned by the group that also owns Taylor Fladgate and Fonseca, Romariz continues to forge its own identity. ",Romariz 2009 Vintage  (Port),92,55,Port,Port, 2009
1970,,Port/Sherry,Portugal,"A firm and structured wine, this shows complex tannins as well as contrasting acidity. It feels complete, the tannins supporting red cherry and spice flavors. It is probably not for long-term aging but will start to taste delicious in 6–7 years. ",Dow's 2010 Quinta do Bomfim Vintage  (Port),92,48,Port,Port, 2010
1971,,Port/Sherry,Portugal,"Fine and ripe, this is a sweet—while also complex—wine from Graham's flagship estate. Its tannins lead easily to ripe flavors of black plum and berry juice, resulting in a wine that is firm, full bodied, fruity and generous. It needs to age. ",W. & J. Graham's 2010 Quinta dos Malvedos Vintage  (Port),93,58,Port,Port, 2010
1972,,Port/Sherry,Portugal,"With firm, smoky tannins and a dark bitter-cherry flavor, this is a dense wine. It is fully ripe and rich, with a firm kick at the back. Tough and age worthy, it expresses the schist soil of the region. ",Duorum 2010 Quinta do Castelo Melhor Vintage  (Port),93,75,Port,Port, 2010
1973,,Port/Sherry,Portugal,"This is opulent, with a perfumed character. It has ripe tannins, which add to the wine's generous nature. The dry edge that comes from the core provides a solid, structured side to this age-worthy effort. ",Quinta do Passadouro 2009 Vintage  (Port),93,80,Port,Port, 2009
1974,14.8,Red,US,"This is just barely drinkable, with modest blackberry fruit. It's hot and Port-like, right through the raisiny finish. ",Calcareous 2009 Cabernet Sauvignon (York Mountain),80,36,California,Cabernet Sauvignon, 2009
1976,15.0,Red,US,"An overripe, high-alcohol wine, this shows bold flavors of raisin, plum, prune, dark chocolate and spice. It almost tastes like Port, although it's dry. ",Zahtila 2008 Mayo Family Vineyards Old Vine Zinfandel (Dry Creek Valley),84,35,California,Zinfandel, 2008
1977,,Port/Sherry,Portugal,"Curiously perfumed and soft in character, this seems already drinkable. It has a geranium fragrance, followed by a strawberry flavor, creating the impression of a light wine. ",Kopke 2010 Quinta de São Luiz Vintage  (Port),86,70,Port,Port, 2010
1978,,Port/Sherry,Portugal,"Floral aromas offer an enticing entry to this soft wine that has the weight of a table wine. Its flavor of juicy blackberry precedes a fragrant, open finish. ",Quinta do Vallado 2009 Vallado Adelaide Vintage  (Port),87,100,Port,Port, 2009
1979,,Port/Sherry,Portugal,"This wine's red berry flavor and soft structure suggest that it will age quickly. However, for now it offers a ripe texture and a juicy character. ",Burmester 2009 Quinta de Arnozelo Vintage  (Port),87,75,Port,Port, 2009
1980,,Port/Sherry,Portugal,"An awkward geranium aroma mars this firm and concentrated wine. It's dry and tannic, with a solid edge akin to black currant skin. The fruit is well hidden at this stage. ",Quevedo 2010 Vintage  (Port),87,70,Port,Port, 2010
1981,,Port/Sherry,Portugal,"This is initially soft, then it broadens out with caramel and ripe plum flavors. Dark cherry sweetens the core of acidity and firm tannins. The wine has good potential. ",Barros 2009 Vintage  (Port),88,65,Port,Port, 2009
1982,,Port/Sherry,Portugal,"A ripe wine from the Real Companhia Velha, this shows a rich character, its tannins ripe and generous. It's not a huge wine, but it does show a fine, full-bodied flavor of sweet plum. The final feeling is smooth and opulent. ",Royal Oporto 2009 Vintage  (Port),88,60,Port,Port, 2009
1983,14.0,Red,Portugal,"This big, bold, structured offering is full of ripe blackberry flavor and integrated tannins. It is intensely rich and already delicious. Bomfim is the main winery for the Dow Port brand. ",Symington Family Estates 2009 Vale do Bomfim Red (Douro),88,12,Douro,Portuguese Red, 2009
1984,20.0,Port/Sherry,Portugal,"This 10-year-old tawny is on the fruity side of this style. It is an easy, dried-fruit-flavored wine with a texture like smooth toffee. Hints of apricot and milk chocolate grace the finish of this ripe Port. ",Barão de Vilar NV 10 Anos Collections Tawny  (Port),88,10,Port,Port,
1985,19.5,Port/Sherry,Portugal,"This Port is structured, with notes of mint and herb. It has blackberry jam flavor and a firm, solid structure, while it also shows intense youthful fruitiness. It is rich and full, showing some firm tannins. Either drink it right now, or leave it for 10 years. ",Quevedo 2010 Quinta Vale d'Agodinho Vintage  (Port),88,75,Port,Port, 2010
1986,20.0,Port/Sherry,Portugal,"This is a finely balanced LBV with structure complementing the luscious black-fruit and raisin flavors. The wine is rich and densely textured, very smooth and unctuous. Big tannins suggest that the wine could age. ",Dão Sul 2008 Quinta das Tecedeiras LBV Late Bottled Vintage  (Port),89,20,Port,Port, 2008
1987,13.0,Red,Portugal,"Ripe and complex, this has big, spicy fruit that rises above the tannins to give a sweet, full mouthfeel. Below the fruit, the dry tannins and wood aging promise the aging potential of three years. ",Prats & Symington LDA 2010 Post Scriptum de Chryseia Red (Douro),90,24,Douro,Portuguese Red, 2010
1988,13.5,Red,Portugal,"Sourced from old vines, this elegant offering shows delicious fruit and great depth of flavor. The tannins slide easily into the red berry note and layered acidity. It shows the structure of the Douro while maintaing an accessible style. ",Symington Family Estates 2009 Vale do Bomfim Reserva Red (Douro),91,25,Douro,Portuguese Red, 2009
1989,14.0,Red,Portugal,"Smooth and rich, this is full of generous, opulent black-fruit flavors. This second wine from the legendary Vesuvio estate is a grand cru in its own right—powerful, structured and full of extremely ripe fruit. It is delicious, but will benefit from 3–4 years of aging. ",Quinta do Vesuvio 2009 Pombal de Vesuvio Red (Douro),92,28,Douro,Portuguese Red, 2009
1990,14.5,Red,Portugal,"Still an icon of Douro reds, this is marked by elegance. The fruit blends effortlessly with the acid-laced, firm tannins. It has fine potential for aging over at least five years. ",Prats & Symington LDA 2009 Chryseia Red (Douro),94,55,Douro,Portuguese Red, 2009
1991,13.5,Red,Portugal,"Capable of standing alongside the great Ports of Vesuvio, this table wine reveals the fantastic quality of its vineyard. It is both powerful and elegant, a wood-aged wine bearing a dense, dark flavor of black plum, with damson-tinged acidity. This impressive wine needs more than 5–6 years of aging. ",Quinta do Vesuvio 2009 Red (Douro),95,73,Douro,Portuguese Red, 2009
1992,16.4,Red,US,"Soft and sweet, this manages to combine Port-like and vegetal flavors in the same glass. The alcohol is an unmanageable 16.4% by volume. ",Hoyt Family Vineyards 2009 Dylema Red (Paso Robles),80,22,California,Red Blends, 2009
1993,16.2,Red,US,"This is a sound example of the warm-climate style of Zinfandel. It's high alcohol gives it a hot, chili-pepper-like sting, and the blackberry fruit has a Port-like, raisiny edge. ",Turley 2010 Dogtown Vineyard Zinfandel (Lodi),84,38,California,Zinfandel, 2010
1997,18.0,Port/Sherry,US,"A compelling Port-like wine made from Petite Sirah, ZInfandel and Syrah grapes aged more than 10 years to form this mix of almonds and sweet apple pie laced with caramel, smooth and easy to drink and pleasant in its Armagnac-like aromas. The almonds come back, laced in maple syrup, on the finish. ",Fenestra NV Tawny Port Port (Lodi),88,35,California,Port,
1999,14.8,Red,US,"This shows the Rockpile personality with its intensely jammy raspberry, cherry and chocolate flavors that are accented by a bit of Port-like heat and set off by good acidity. The pleasure is in the power. ",Bruliam 2010 Rocky Ridge Vineyard Zinfandel (Rockpile),89,35,California,Zinfandel, 2010
2000,18.0,Port/Sherry,Spain,"Golden-brown in color, this has heady aromas of cola, nut, nutmeg, root beer and caramel. It feels full, slightly rich and properly cut, with coffee, toffee, chocolate and honey flavors. A balanced but elevated dessert-style Sherry that gets it right. ",Bodegas Dios Baco S.L. NV Cream Sherry Sherry (Jerez),90,15,Andalucia,Sherry,
2001,18.0,Port/Sherry,Spain,"With a nose of toffee, dried apricot, cocoa powder and rancio, this is classic off-dry amontillado. It feels fresh and active, then tastes rich and moderately sweet, with flavors of hazelnut, caramel, toasted banana, orange and spice. Nutty and smooth on the finish. ",Bodegas Dios Baco S.L. NV Amontillado Sherry (Jerez),90,15,Andalucia,Sherry,
2002,17.0,Port/Sherry,Spain,"A sensuous sweet Sherry, this has the full monty of fig, date, licorice, root beer and chocolate aromas and flavors. It's naturally thick and sweet but also balanced, so it doesn't come across like a spoonful of syrup. Great as a dessert wine with cake or blue cheese, but also as a topping for vanilla or coffee ice cream. ",Bodegas Dios Baco S.L. NV Oxford 1.970 Pedro Ximénez (Jerez),91,15,Andalucia,Pedro Ximénez,
2005,14.2,Red,US,"In this wine, it appears that 2008's late-season heat spikes got the best of the grapes. The wine has raisiny, Port-like aromas and tastes, with bitterness from shriveled raisin skins. It doesn't offer much pleasure. ",Martin Ranch 2008 Thérèse Vineyards Cabernet Sauvignon (Santa Cruz Mountains),81,45,California,Cabernet Sauvignon, 2008
2006,14.9,Red,US,"This is so overripe that it tastes like Port, with raisin and milk chocolate flavors, and a hot, spicy finish. ",X 2008 Mash Red (Napa Valley),81,60,California,Red Blends, 2008
2007,14.2,Red,US,"This is a fruit-driven, sharp and Port-like red wine, blended from Petit Verdot, Malbec, Grenache and Nebbiolo. ",X 2009 Saved Red (California),81,35,California,Red Blends, 2009
2008,14.0,Red,US,"This tastes like Port, with raisin, prune and chocolate flavors. Drink up. ",Martin Ranch 2008 J.D. Hurley Cabernet Sauvignon (Santa Cruz Mountains),81,25,California,Cabernet Sauvignon, 2008
2009,15.4,Red,US,"Thick and heavy, this is Port-like in its toffee and raisin aromas, with a trace of licorice in the background. Its syrupy consistency almost expresses an air of oxidation. ",Domenico 2007 Primitivo (Amador County),83,30,California,Primitivo, 2007
2010,13.5,Red,Portugal,"This jammy, fruity offering tastes as though it were made from overripe fruit. Its light structure offers acidity and a Port-like character. Not for aging. ",Quinta de Ventozelo 2010 QV Tinto Red (Douro),84,13,Douro,Portuguese Red, 2010
2011,14.5,Red,US,"From a vineyard west of Ukiah, Jacuzzi Family's Barbera seems tartly sweet, akin to raspberry syrup laced with vanilla. Soft and round, it has a finish like that of an aged Port. ",Jacuzzi 2010 Barbera (Mendocino County),84,16,California,Barbera, 2010
2013,15.2,Red,US,"High alcohol and very ripe fruit combine to make this reminiscent of Port. It tastes of black currant and blackberry jam, with a hint of raisin. Although it won't please everyone, it is a good example of its warm-climate style. ",Dunning Vineyards 2010 Reserve Zinfandel (Paso Robles),85,38,California,Zinfandel, 2010
2014,14.7,Red,US,"It's easy to imagine drinking this wine—and really enjoying it—in Paso Robles with a grilled steak. It's rich, heady and ripe in black currants, with a Port-like, raisiny taste. ",La Filice 2009 Via Della Vigna Red (Paso Robles),87,25,California,Red Blends, 2009
2015,15.4,Red,US,"While this Cabernet is very rich and ripe in flavors of blackberry and cherry jam, crème de cassis and new oak, it's also very tannic. That bite of astringency gives it a rustic note. A very high, Port-like alcohol level may or may not thwart cellaring plans. ",Grgich Hills 2008 Yountville Selection Cabernet Sauvignon (Napa Valley),88,150,California,Cabernet Sauvignon, 2008
2017,14.8,Red,US,"This is too ripe, with a disagreeable pruny taste. The wine is dry and full bodied, but is almost like a minor Port. The official alcohol reading is 14.8% by volume, but it tastes higher and hotter than that. ",Heart O' The Mountain 2009 Estate Reserve Pinot Noir (Santa Cruz Mountains),82,48,California,Pinot Noir, 2009
2018,16.2,Red,US,"This seems so sweet, it's practically a Port dessert wine. It's soft and simple, with chocolate and blackberry jam flavors. ",Calcareous 2010 Zinfandel (Paso Robles),82,34,California,Zinfandel, 2010
2019,15.4,Red,US,"With very high alcohol, this is almost a dessert, Port-style wine. It's soft and hot, with sweet blackberry jam, milk chocolate and licorice flavors. ",Minassian-Young 2010 Estate Zinfandel (Paso Robles),84,25,California,Zinfandel, 2010
2020,14.8,Red,US,"This seems sweet like a Port. It tastes like raspberry and cherry jam, with lots of heat from the alcohol. ",Minassian-Young 2010 1000 Vines Zinfandel (Paso Robles),84,25,California,Zinfandel, 2010
2022,18.5,Dessert,US,"This is quite a sweet wine, rich and heady in chocolate, blackberry and blueberry jam and caramel flavors. It could be more concentrated, as it's a little thin. The variety is Petite Sirah. ",Field Stone 2008 Staten Family Reserve Vintage Port (Alexander Valley),86,50,California,Port, 2008
2023,19.0,Dessert,US,"Intense sweetness goes a long way toward making this dessert wine delicious and satisfying. While it's a bit lacking in fruity concentration, it does have good blackberry and milk chocolate flavors. ",Valley of the Moon 2007 Late Bottled Vintage Port (Sonoma County),86,30,California,Port, 2007
2025,20.0,Port/Sherry,Portugal,"Rich and fruity, this is rounded as well as concentrated. It's on the sweet side, yet its acidity and blend of black and dried fruits are finely balanced. Like all LBVs, it can be consumed now, but it can also age over several years. ",Quinta do Portal 2007 Late Bottled Vintage  (Port),89,25,Port,Port, 2007
2026,20.0,Port/Sherry,Portugal,"This is rich, with an old wood feel and a sweet, still-fruity character. With its acid balance, this is fresh, round and perfumed. ",Barros NV 20-Years Old Tawny  (Port),90,20,Port,Port,
2027,20.0,Port/Sherry,Portugal,"Approaching tawny in color, this is a mature white Port. It has a wood-aged tang, with spice and toast flavors that have given the wine an old gold feel. The surface is sweet, yet there is an underlying dryness. ",Cálem NV 10-Years Old White  (Port),91,61,Port,Port,
2028,20.0,Port/Sherry,Portugal,"Deep and dark, this has powerful herb and spice flavors alongside the concentrated tannins and notes of ripe black fruits and raisins. This has impressive density and is still youthful, demonstrating fine aging potential. ",Quinta do Portal 2009 Vintage  (Port),92,70,Port,Port, 2009
2030,15.2,Red,US,"The high alcohol shows through everything else, giving this Zin a chili pepper heat and a distracting Port-like sensation. It's rich and dry, with firm tannins framing the blackberry and currant flavors. ",Rosenblum 2010 Richard Sauret Reserve Zinfandel (Paso Robles),86,30,California,Zinfandel, 2010
