,wine_alcohol,wine_category,wine_country,wine_description,wine_name,wine_point,wine_price,wine_region,wine_variety,year
642,,Red,Portugal,"The second label of Quinta de Roriz, from the lighter 2002 vintage, is a wine for early drinking. It has fresh red fruits, soft tannins and good balancing acidity. The word “prazo,” meaning “lease”, was the name given to the quinta in the 18th century. ",Quinta de Roriz 2002 Prazo de Roriz Red (Douro),85,13,Douro,Portuguese Red, 2002
643,,Port/Sherry,US,"Sweet, rich in tannins, high in peppery alcohol and with a chocolatey, blackberry richness, this dessert wine is fun on its own, or beside a perfect espresso after a big, late night dinner. ",DeRose 1995 Port (Cienega Valley),85,26,California,Port, 1995
644,15.0,Port/Sherry,Spain,"From Real Tesoro, this fino is dry and chalky, with spiky blanched-almond flavors and a heavy, astringent aftertaste of sautéed mushrooms. ",Marques del Real Tesoro NV Tio Mateo Fino Seco y Suave Sherry (Jerez),82,15,Andalucia,Sherry,
645,,Port/Sherry,US,"Mute aroma, but turns sweet and chocolatey-cherry in the mouth, with good acidity, and very clean. A pleasant dessert quaffer. ",Boitano 2002 Port (Sierra Foothills),86,14,California,Port, 2002
646,,Port/Sherry,Portugal,"Not an intense or concentrated wine, perhaps, but this Reserve Port from Churchill's is well balanced and finely structured. There are flavors of green figs that give it freshness, and a dry aftertaste. A slight stalky flavor is the only off note. ",Churchill's NV Finest Vintage Character  (Port),86,17,Port,Port,
647,,Port/Sherry,Portugal,"W & J Graham makes one of the best-known Reserve Port brands. And a great wine it is, too. It is soft, but there are tannins. It is fruity, but there is good concentration. And with its flavors of ripe black figs and dark chocolate, it is an immediately appealing wine. ",W. & J. Graham's NV Six Grapes Reserve  (Port),89,21,Port,Port,
648,,Port/Sherry,Spain,"A classic manzanilla with aromas of honey, apple, blanched almonds and salt air. Fresh and exuding clarity not found in every fino or manzanilla. Quite apple-driven on the palate, with hints of mushroom and buttered toast. Flavorful, lithe and on the money. ",Barbadillo NV Solear Manzanilla Sherry (Jerez),89,9,Andalucia,Sherry,
649,19.0,Port/Sherry,Spain,"Almost shocking at first, due to strong, unyielding peanut and iodine aromas. Remains intense on the palate, where salt, butter and almonds mix nicely. Sharp and racy on the finish, with good flow. A word of warning: there's nothing cuddly or sweet about this. It's old-style, traditional Sherry made for the connoisseur. Imported by W.J. Deutsch & Sons. ",Osborne NV Solera Primera Rare Amontillado Sherry (Jerez),90,90,Andalucia,Sherry,
650,18.0,Port/Sherry,Spain,"It's rare that a sweet sherry reaches such heights, but here's a case in point. Iberia has impeccable prune and raisin aromas along with intoxicating scents of toffee and cane sugar. All in all, the bouquet is excellent. The palate, meanwhile, is seamless as it deals raisin, vanilla and mocha. Spot on for a dessert elixir, with a ceaseless finish. ",Sanchez Romate NV Iberia Cream Sherry (Jerez),93,15,Andalucia,Sherry,
651,,Port/Sherry,Portugal,"A pure fruited wine, with an unusual touch of toast and new wood. The fruit is well structured with flavors of thyme and rosemary. This is a smooth, polished Port, which is definitely in a modern style of winemaking. Imported by William Grant USA. ",Quinta do Noval 2003 Vintage  (Port),90,95,Port,Port, 2003
652,,Port/Sherry,Portugal,"The wine is big, full, opulent and super-ripe. But the tannins are also there, giving a dark, brooding edge, which comes through powerfully on the finish. This is the best vintage yet from this Roederer-owned house. Imported by Maisons Marques & Domaines USA. ",Ramos-Pinto 2003 Vintage  (Port),94,65,Port,Port, 2003
653,,Red,US,"Fully dry, at the cost of 15.8% alcohol, this enormous Zin wears its size well. There's a Port-like, raisiny note, but it's more of a subtle seasoning than a takeover, and the wine is balanced in its own distinctively Zinny way. ",Wellington 2003 100 Year Old Vines Zinfandel (Sonoma Valley),89,30,California,Zinfandel, 2003
654,20.0,Port/Sherry,Portugal,"A very ripe style, with baked plum and prune aromas and flavors supported by hints of pastry crust and dried spices. Medium to full in body, with soft tannins and a long, spicy finish. Imported by Supreme Wines & Spirits. ",Quinta de Ventozelo 2000 LBV  (Port),89,19,Port,Port, 2000
655,,Port/Sherry,Portugal,"Rather brown in color, this wine is sweet, soft and chocolaty, spoiled by volatility and unbalanced acidity. ",Messias NV 10-year old tawny  (Port),82,20,Port,Port,
656,,Port/Sherry,Portugal,"With French winemaker Jean-Hugues Gros (who used to work in Burgundy with Jacques Prieur) in charge, Heredias  is producing both table wines and Ports. This 10-Year Oldis sweet, fresh, with caramel flavors, leavened with fresh acidity in the aftertaste. ",Quinta das Heredias NV 10-year old tawny  (Port),86,28,Port,Port,
657,,Port/Sherry,Portugal,"A very sweet style, with flavors of Hershey bars, figs, vanilla and caramel. Rather out of balance. ",Offley NV 10-year old tawny  (Port),86,26,Port,Port,
658,,Port/Sherry,Portugal,"A dense, firm style of wine from this small Dutch-owned Port house. Offers good acidity, old wood and very bitter chocolate flavors. The aftertaste, by contrast, is sweet. ",C. da Silva NV Presidential 30-year old tawny  (Port),87,80,Port,Port,
659,20.0,Port/Sherry,Portugal,"If it wasn't for the unbalanced spirity element to this wine, it would rate higher. The concentration and the dried fruit and lemon jelly flavors are attractive. But that spirit comes through at the finish. ",Rozes NV 20-year old tawny  (Port),87,50,Port,Port,
660,,Port/Sherry,Portugal,"A delicious, easy wine that floats by with orange marmalade and fresh acidity. Marred on the finish by some volatility. ",Royal Oporto NV 20-year old tawny  (Port),87,48,Port,Port,
661,,Port/Sherry,Portugal,"This is a very easy, light and fresh style, with sweet caramel flavors balanced by sweet figs and milk chocolate. It finishes  clean, with just a touch of acidity. ",Quinta de Ventozelo NV 10-year old tawny  (Port),87,30,Port,Port,
662,,Port/Sherry,Portugal,"Ripe and fresh. There are touches of bitter oranges, lemon peel and ginger. The aftertaste is soft and sweet. ",Churchill's NV 10-year old tawny  (Port),87,30,Port,Port,
663,,Port/Sherry,Portugal,"A fine, sweet, fresh wine, which tastes younger than 30 years. The flavors are ripe, layering milk chocolate with acidity in good balance. ",Kopke NV 30-year old tawny  (Port),87,122,Port,Port,
664,,Port/Sherry,Portugal,"A generally balanced sweet wine, with layers of candied fruits, and sweet marmalade flavors. The ripeness and the sweetness are spoiled by the volatility that shows in the finishing acidity. ",Poças NV 20-year old tawny  (Port),87,50,Port,Port,
665,,Port/Sherry,Portugal,"A very soft style from a vineyard run by the Olazabal family. There is sweetness, allied with cocoa flavors and a touch of burnt coffee. There's a very attractive sweet black fig character to finish. ",Quinta do Vallado NV 10-year old tawny  (Port),87,10,Port,Port,
666,,Port/Sherry,Portugal,"Santa Eufemia is a new name on the U.S. market, from a vineyard in the Baixo Corgo, the western end of the Port vineyards. This is a mature 10-year-old, light in color and dry, with coffee and cocoa flavors. There is a delicious, lightly acidic, long-lasting aftertaste. ",Casa Santa Eufemia NV 10-year old tawny  (Port),88,39,Port,Port,
667,,Port/Sherry,Portugal,"A very sweet rich wine, in the Fonseca house style. But it lacks the intensity, going more for sweet almonds, along with some bitter marmalade, and a young taste. Imported by Kobrand. ",Fonseca NV 40-year old tawny  (Port),88,157,Port,Port,
668,,Port/Sherry,Portugal,"Very soft, but with good concentration, this bitter orange flavored wine has ripeness, but also acidity, finishing with some bitter chocolate flavors. Attractively balanced. ",Delaforce NV His Eminence's Choice 10-year old tawny  (Port),88,23,Port,Port,
669,,Port/Sherry,Portugal,"Barros is not well known outside Portugal, but this wine suggests it should be. Delicate and perfumed, this has a fine balance that leaves a fresh, fruity aftertaste. There is structure, sweetness and ripeness. ",Barros NV 10-year old tawny  (Port),88,22,Port,Port,
670,,Port/Sherry,Portugal,"A clean, very poised style, with attractive acidity and good balance. It's just as deliciously fresh as a 10-Year Oldshould be. ",Wiese & Krohn NV 10-year old tawny  (Port),88,25,Port,Port,
671,,Port/Sherry,Portugal,"An intensely sweet wine, with mature fruit that shows some richness and orange marmalade flavors. It is spoiled by a hint of volatility, which leaves a sharp aftertaste. Imported by Admiral Imports. ",Royal Oporto NV 40-year old tawny  (Port),88,128,Port,Port,
672,,Port/Sherry,Portugal,"Layers of dried fruits and prunes give a fruity character to this gently sweet wine. It's very elegant and delicate, but certainly very drinkable. ",Quinta de Ventozelo NV 20-year old tawny  (Port),88,40,Port,Port,
673,,Port/Sherry,Portugal,"A full-bodied, dense and very concentrated wine that just misses being intensely rich because of a touch of burnt rubber. It is certainly powerful, and the dried prune flavors are ripe and sweet. ",Quinta do Vallado NV 20-year old tawny  (Port),88,20,Port,Port,
674,,Port/Sherry,Portugal,"Apart from the fact that this tastes too fresh to be a 30-year-old, this is a delicious wine, with ripe, sweet fruits, caramel and just the right layer of dryness. ",Taylor Fladgate NV 30-year old tawny  (Port),88,115,Port,Port,
675,,Port/Sherry,Portugal,"A firm style of wine, from the oldest Port producer. With tannins and bitter almond and chocolate flavors, this is certainly on the drier side. ",Kopke NV 10-year old tawny  (Port),88,28,Port,Port,
676,,Port/Sherry,Portugal,"Caramel, white chocolate aromas, and unbalanced sweet and sour flavors just do not show well together in this disappointing wine. ",Warre's NV Sir William 10-year old tawny  (Port),83,26,Port,Port,
677,,Port/Sherry,Portugal,A very old wine which smells medicinal and tastes like sweet cough syrup. It's so concentrated as to be almost undrinkable. ,Rozes NV 40-year old tawny  (Port),83,120,Port,Port,
678,,Port/Sherry,Portugal,"A very old, too concentrated, medicinal, Italian bitters-flavored wine that tastes too herbal to give much pleasure. Imported by Wine Worth LLC. ",Kopke NV 40-year old tawny  (Port),83,180,Port,Port,
679,,Port/Sherry,Portugal,This wine certainly doesn't taste its age. It has more to do with sweet almond cookies and unbalanced spirit than mature flavors. Imported by Langdon Shiverick. ,Quinta das Heredias NV 40-year old tawny  (Port),83,130,Port,Port,
680,,Port/Sherry,Portugal,"A hugely, almost uncomfortably sweet wine with strong aromatics. It has some attractive acidity, but the sweetness detracts from any other character. ",Cockburn's NV 10-year old tawny  (Port),83,30,Port,Port,
681,,Port/Sherry,Portugal,"An easy, fresh, ripe style, with dried fruits and a perfume note that is spoiled  by the rubber character and some old wood. Anybody who stays in Portugal's pousadas, the state-run hotels, will have had this brand. ",C. da Silva NV Presidential 20-year old tawny  (Port),84,50,Port,Port,
682,,Port/Sherry,Portugal,"Oreo eaters will enjoy the aromas of this wine, with its sweet, milk chocolate tastes. But apart from that it is unbalanced, too acid for real pleasure. ",Casa Santa Eufemia NV 30-year old tawny  (Port),84,30,Port,Port,
683,,Port/Sherry,Portugal,"This is a very old 40-year old, with some harsh, burnt and rubber flavors. There's high acidity and caramel toffee, masking the mature fruit. Imported by HGC Imports. ",Poças NV 40-year old tawny  (Port),84,130,Port,Port,
684,,Port/Sherry,Portugal,"This is more like an Italian bitters than a Port, with its roasted coffee aromas, and bitter flavors. Almost medicinal. ",Messias NV 30-year old tawny  (Port),84,60,Port,Port,
685,,Port/Sherry,Portugal,"A sadly unbalanced wine from a company that has a name for tawny Ports. With its sweetness, marred by a touch of reduction (too long in old barrels?), it has a curious sweet/sour aftertaste. ",Ferreira NV 10-year old tawny  (Port),84,10,Port,Port,
686,,Port/Sherry,Portugal,"This is very burnt, offering concentrated old fruit flavors and tasting very mature, straight from the barrel. There's some bitterness, but the main impression is of very old wine. Imported by T. Edward Wines Ltd. ",Casa Santa Eufemia NV 40-year old tawny  (Port),85,40,Port,Port,
687,,Port/Sherry,Portugal,"A dry, fruity wine, burnt with acidity and somewhat unbalanced spirit. It's firm, dry, but rather dull. ",Quarles Harris NV 10-year old tawny  (Port),85,10,Port,Port,
688,,Port/Sherry,Portugal,"This is a huge, concentrated, dry wine, which is left very unbalanced by the burnt character and the dominance of the spirit. tThe acid ity, at least, leaves freshness. ",Warre's NV Plus 20-year old tawny  (Port),85,46,Port,Port,
689,,Port/Sherry,Portugal,"A very soft, easy wine, with some good concentration that just lacks a central core. ",Quinta do Portal NV 10-year old tawny  (Port),85,22,Port,Port,
690,,Port/Sherry,Portugal,"A well-balanced, simple wine, with pleasant rich fruit and refreshing acidity. This tastes younger than a 20-year-old, but is still attractive enough. ",Barros NV 20-year old tawny  (Port),85,42,Port,Port,
691,,Port/Sherry,Portugal,"It is the harshness, with unbalanced spirit, that mars what is otherwise a mature, dry style with good burned caramel flavors. ",Sandeman NV 20-year old tawny  (Port),85,50,Port,Port,
692,,Port/Sherry,Portugal,"Rozes has always supplied the French market with inexpensive Port. But it is also able to produce some more serious aged tawnies, such as this fresh, ripe, fig-flavored wine. ",Rozes NV 10-year old tawny  (Port),86,27,Port,Port,
693,,Port/Sherry,Portugal,"An attractive, relatively simple wine with dense chocolate flavors and some good, concentrated fruit. ",Barros NV 30-year old tawny  (Port),86,85,Port,Port,
694,,Port/Sherry,Portugal,"This independent company has a reputation for its aged tawnies. This 10-Year Oldis in the sweet style, but it has a fine freshness, as well as flavors of figs and firm, structured fruit at its core. ",Poças NV 10-year old tawny  (Port),86,20,Port,Port,
695,20.0,Port/Sherry,Portugal,"Floral and spicy on the nose, leading into ripe blackberry and blueberry flavors. Not the richest mouthfeel or deepest flavors, but a pretty Port that finishes with crisp acidity and firm tannins. Drink 2010–2020. Imported by Signature Imports. ",Poças 2001 Vintage  (Port),89,70,Port,Port, 2001
696,19.5,Port/Sherry,Portugal,"With its gorgeous scents of spice cake and dates, this is a seductive LBV from the very start. It's ripe and round in the mouth, soft and lush on the finish, with a cavalcade of fig, date, chocolate and dried-spice flavors. Drink now. Imported by Premium Port Wines, Inc. ",Dow's 2000 LBV  (Port),89,20,Port,Port, 2000
698,20.0,Port/Sherry,Portugal,"Plummy on the nose, with the ripe aromas accented by hints of dried flowers. In the mouth, the texture is rich—almost syrupy—and the flavors head toward prune and chocolate fudge, finishing on drier, more complex notes of cocoa powder and spice. Imported by Kobrand. ",Fonseca 2000 LBV  (Port),90,25,Port,Port, 2000
699,,Port/Sherry,Portugal,"Still in the flush of youth, this creamy-textured vintage Port strikes all the right notes, from complex aromas to powerful flavors. Blackberry, plum and earth notes finish long, buttressed by supple tannins. Based on the rapid maturation of the 2001 and 2002, drink this one from 2010-2020. ",Quinta de Ventozelo 2003 Vintage  (Port),92,60,Port,Port, 2003
700,20.0,Port/Sherry,Portugal,"Already throwing considerable sediment and possessed of a creamy, supple mouthfeel, this is a vintage Port that should probably be consumed young. Enjoy its lush blueberry fruit, chocolate and spice complexity over the next 10 years. Imported by Supreme Wines & Spirits. ",Quinta de Ventozelo 2002 Vintage  (Port),92,50,Port,Port, 2002
701,15.8,Red,US,"Pours dark and heavy looking, and the aroma suggests Port, which the first sip confirms. Despite official descriptions as dry, the wine tastes sweet and hot, thanks to nearly 16 percent of alcohol. ",Holdredge 2004 Zinfandel (Alexander Valley),80,24,California,Zinfandel, 2004
702,19.0,Dessert,US,"Try this sweet, soft, simple sipper, with its flavors of crème de cassis, rum and cola, and sugared coffee, with crunchy butter cookies or pound cake. ",Brutocao 2004 Feliz #62 Zinfandel Port (Mendocino),85,32,California,Port, 2004
705,,Port/Sherry,Portugal,"There are many failings here: reductive, volatile, unbalanced acidity. But just somewhere there is a small streak of orange marmalade. ",Quinta das Heredias NV 20-year old tawny  (Port),80,50,Port,Port,
706,,Port/Sherry,Portugal,"The burnt character is too dominant in this wine, and it smothers any fruit there is. Just a touch dry as well. ",Feist NV 20-year old tawny  (Port),81,49,Port,Port,
707,,Port/Sherry,Portugal,"Tart, hard and burnt, this wine is completely spoilt by the harsh spirits which dominate. ",Messias NV 20-year old tawny  (Port),81,40,Port,Port,
708,,Port/Sherry,Portugal,"This tastes very old, and any fruit is suppressed by flavors of liquorice and burnt wood. ",Casa Santa Eufemia NV 20-year old tawny  (Port),82,20,Port,Port,
709,,Port/Sherry,Portugal,"Lovers of Italian bitters should pay attention to this wine. It's medicinal character is very intense, very herbal. Good for the stomach, maybe, but it's not Port. ",Barros NV 40-year old tawny  (Port),82,130,Port,Port,
710,,Port/Sherry,Portugal,"This has a burnt, dry style, with high acidity. It tastes more mature than a 10-year-old. ",Feist NV 10-year old tawny  (Port),82,23,Port,Port,
711,,Port/Sherry,Portugal,"Dry, rather burnt, with sweetness, but dominated by unbalanced spirit. ",Cockburn's NV 20-year old tawny  (Port),82,50,Port,Port,
712,,Port/Sherry,Portugal,"Very burnt and harsh, with spirit dominating, this is a sad showing for such a famous name. ",Croft NV 20-year old tawny  (Port),82,53,Port,Port,
713,,Dessert,US,"Like a nice LBV Port, this is a not too sweet, richly fruited wine balanced by crisp acids. The flavors veer toward dark chocolate, with crème de cassis and roasted coffeebean accents and an orange peel or marmalade flourish. It's a marvelous, delicious sipper on a late, cold night. ",Williams Selyem 2001 Mistral Vineyard Port (Central Coast),93,35,California,Port, 2001
714,,Red,US,"It's hard to know what to make of this wine. With 17.4% alcohol, it's more of a Port, except that it's dry. It's clean, with firm tannins framing deep coffee, blackberry and leather flavors, and actually possesses some charm and elegance despite the size. ",Stuart Cellars 2003 Select Reserve Zinfandel (Temecula),85,30,California,Zinfandel, 2003
715,15.0,Port/Sherry,Spain,"Yellow in tint, with slightly pasty aromas that quickly morph into nuttiness. The palate is full of nuts and butter, while the finish throws off mushroom. Not oxidized, but on the round side. ",Bodegas Dios Baco S.L. NV Fino Sherry Sherry (Jerez),87,18,Andalucia,Sherry,
716,15.0,Port/Sherry,Spain,"Perfectly good and fresh, and consistent with years past. This manzanilla earns points for its dryness, its good mouthfeel, and its nutty finish. Is it the most complex wine from Sanlucar? Maybe not; but it's tasty and made right. ","Domecq NV Light, Very Dry Manzanilla Sherry (Jerez)",87,14,Andalucia,Sherry,
717,17.0,Port/Sherry,Spain,"Clean, nutty and smooth, if a touch neutral on the nose. The palate pushes more nuts and distant white fruits, followed by a finish of fleur de sel and cashew butter. Slightly heavy but that's the style; like its sister manzanilla, this wine is very consistent year to year. ",Domecq NV La Ina Fino Sherry (Jerez),88,14,Andalucia,Sherry,
719,16.0,Port/Sherry,Spain,"Quite yellow, with toffee, peanuts and light fruit aromas. Big and round in the mouth, with dried apple, almond and white pepper flavors. Full and long late, with tons of texture and a strong mushroom accent. Powerful, so you'd better be a fino fan if you're going to tackle this one. ",Sanchez Romate NV Fino Marismeno Reservas Sherry (Jerez),90,15,Andalucia,Sherry,
720,15.0,Port/Sherry,Spain,"Top-notch manzanilla, plain and simple. What's not plain and simple is the fact that this is so pure and smooth that it dances across your palate. From the vanilla and almond on the nose to the pastry and mushroom on the palate to the creamed butter on the finish, this is as good as it gets in this class. ",Bodegas Dios Baco S.L. NV Manzanilla Sherry (Jerez),91,9,Andalucia,Sherry,
722,,Dessert,US,"Harsh in texture, this Port-style wine has strong flavors of mocha and sweet blackberry and cherry marmalade. As attractively sweet as it is, there's a sharp roughness that detracts. ",Dry Creek Vineyard 2003 Late Harvest Zinfandel (Dry Creek Valley),83,30,California,Zinfandel, 2003
723,,Dessert,US,"Only 150 cases were produced of this wine. It's a lovely sipper, rich and sweet in cassis, coffee and chocolate flavors that are wrapped in smooth, velvety tannins. The fruity sweetness really kicks in mid-palate and lasts through a decadant finish. ",Lolonis 2003 Late Harvest Zinfandel Port Zinfandel (Redwood Valley),92,32,California,Zinfandel, 2003
724,,Dessert,US,"Made from Viognier and Roussanne, this intensely sweet wine has rich flavors of the ripest apricots and white peaches, drizzled with vanilla and cinnamon spice. The texture can only be described as voluptuous. Acidity is good, providing a cleansing balance. The alcohol is a very high 18 percent. This is sheer decadence. ",Shenandoah 2004 ReZerve White Port White (Amador County),93,17,California,White Blend, 2004
725,20.5,Dessert,US,"Made with Portuguese varieties, this dessert wine is sweet and simple. It has cherry compote, chocolate and sweetened coffee flavors, with a thick texture balanced with good, crisp acidity. ",Robert Hall 2003 Vintage Port (Paso Robles),84,28,California,Port, 2003
726,19.5,Port/Sherry,Portugal,"Shows a lifted fruit character on the nose—maybe even a little hint of nail polish—but also some earth and berry scents. Bright raspberry flavors on the palate are backed by mineral notes, finishing crisp. Lacks the weight and structure of the best vintage Ports. Imported by W.J. Deutsch & Sons. ",Quinta do Vale Meão 2003 Vintage  (Port),87,30,Port,Port, 2003
727,20.0,Port/Sherry,Portugal,"Less lush and welcoming than the other LBVs reviewed for this issue, C. da Silva's Presidential brand instead shows more acidity and tannin. The result is a crisp, pepper- and plum-flavored Port with a slight rancio quality. Imported by Jack Poust & Co., Inc. ",Presidential 2000 LBV  (Port),87,20,Port,Port, 2000
728,14.0,Red,Portugal,"This is a bold, exuberantly fruity blend of 40% Touriga Franca, 40% Tinta Roriz and 20% Tinta Barroca. Mulberry and boysenberry flavors pick up hints of baked pie crust. A bit drying on the finish, but it also shows good depth of fruit. A new wine, with no track record for aging, so drink now and over the next few years. Imported by Premium Port Wines, Inc. ",Dow's 2004 Vale do Bomfim Reserva Red (Douro),88,12,Douro,Portuguese Red, 2004
729,20.0,Port/Sherry,Portugal,"Doesn't show the richness or complexity of its younger counterparts, but this effort from Ventozelo is still pretty good. Modest floral and chocolate notes and youthful grapy flavors hint at further aging potential, but the tannins are already soft. Better to err on the young side and drink it over the next several years. Imported by Supreme Wines & Spirits. ",Quinta de Ventozelo 2001 Vintage  (Port),88,50,Port,Port, 2001
730,20.0,Port/Sherry,Portugal,"With its charming aromas of spice drop, ripe cherries and schistous minerality, this Taylor looks set to zoom. And it is tasty, but also a bit soft and lacking structure—something unexpected from a Port under the Taylor label. Turns chocolaty on the finish. Drink now. Imported by Kobrand. ",Taylor Fladgate 2000 LBV  (Port),88,25,Port,Port, 2000
731,13.5,White,Portugal,"The Symington family continues to make strides in their table wine production. This is a full-bodied, smooth-textured bistro-styled red that's more of a dark purple in hue, bringing blackberry, blueberry and spice and mineral notes to the table. Enjoy it over the next year or two for its exuberant fruit. Imported by Premium Port Wines, Inc. ",Quinta de Roriz 2004 Prazo de Roriz Red (Douro),89,14,Douro,Portuguese Red, 2004
732,,Port/Sherry,Portugal,"Potentially one of the best wines of the vintage, this is an extraordinary performance from a producer not previously noted for making such high-quality Vintage Ports. The wine—a special selection that at this stage, has no name—has great ripe fruit and huge tannins combined to make a dense, intense wine. It is dark, brooding and rich. There are also layers of dryness which shows the aging potential of this great wine. Imported by MHW, Ltd. ",Quinta do Portal 2003 Vintage  (Port),95,60,Port,Port, 2003
733,,Port/Sherry,Portugal,"Hugely ripe fruit dominates this wine. But, as so often with a Taylor Fladgate Port, this fruit is balanced out with beautiful perfumes, elegant tannins and complex layers of dryness, sweetness and acidity. This is a great wine, maybe not as long-lived as some Taylor Fladgate vintages of the past, but certainly destined for many years of aging. Imported by Kobrand. ",Taylor Fladgate 2003 Vintage  (Port),95,92,Port,Port, 2003
